video_id,title,description,category_id,keyword
LSZCzodU3L0,CORTIS (코르티스) - FaSHioN | Show! MusicCore | MBC250920방송,CORTIS (코르티스) - FaSHioN | Show! MusicCore | MBC250920방송 #CORTIS #FaSHioN #MBCKPOP More clips are ...,10,fashion
OIHeebw5AIk,CORTIS - FaSHioN #엠카운트다운 EP.906 | Mnet 250918 방송,티빙에서 스트리밍 : https://tving.onelink.me/xHqC/30a78d6f M COUNTDOWN｜Ep.906 코르티스 - 패션 (CORTIS - FaSHioN) ...,24,fashion
lBSFuaWZJIQ,&#39;최초 공개&#39; CORTIS - FaSHioN #엠카운트다운 EP.905 | Mnet 250911 방송,티빙에서 스트리밍 : https://tving.onelink.me/xHqC/30a78d6f M COUNTDOWN｜Ep.905 코르티스 - 패션 (CORTIS - FaSHioN) ...,24,fashion
ZZ6ylOBauOg,How where you place your clothes can effect how your body shape looks! 💘 #pearshape #fashion,,22,fashion
vRfBuJjGzmY,Horsewalk or catwalk?!😎 #catwalk #fashion,,22,fashion
aX9UIHoAbWo,Britney Manson - FΛSHION (Lyrics) | make it to the high fashion,Britney Manson - FΛSHION (Lyrics) | make it to the high fashion: https://spoti.fi/41uEUwC ⭐Follow TikTokTunes Instagram: ...,10,fashion
aDRD4OvNvus,Britney Manson - FASHION (Slowed),Slowed version of FASHION by Britney Manson Listen to Britney Mason: ...,10,fashion
6oCuukwHV1I,CORTIS FaSHioN Easy Lyrics,CORTIS FaSHioN Easy Lyrics ..................................................................................... cortis fashion cortis fashion cortis fashion lyrics ...,10,fashion
SxkODe_Bv5Q,Clothes I BETTER not see at school soon🙏🫶#fashion #school#style #shoes #aesthetic#clothes #cute,,22,fashion
w6xA64Wd_f0,FASHION meme || Looey Showtime skins || READ DESC #dandysworld,"bro y'all confused bc what ""Penelitian"" is   It has the same meaning as Research its my language:v it only costs 80 robux to me ...",22,fashion
XWMtpCKtAQc,HOW TO ACTUALLY STYLE YOUR CLOTHES bc it’s not the clothes it’s you #styletips #ootd #outfitinspo,,22,fashion
M9APdDCGKxQ,[여기서요?] 코르티스 CORTIS - FaSHioN | 커버댄스 Dance Cover @홍대,ARTBEAT DANCE VIDEO 멤버십에 가입해 ARTBEAT를 후원해 주세요!!,24,fashion
eFeS_6fAQPw,passion for FaSHioN w/ #JamRepublic #KirstenDodgen &amp; #LatriceKabamba #CORTIS #코르티스 #CORTIS_FaSHioN,,24,fashion
Krbn5CKrKrE,Isis Fashion Show 2025 | Zaid Nakad vs Isis Fashion Show | Classic Style Meets Bold Fashion,Isis Fashion Show 2025 | Zaid Nakad vs Isis Fashion Show | Classic Style Meets Bold Fashion! Watch the ultimate fashion ...,25,fashion
KqMUiwm5JDQ,"Chic &amp; Elegant Fashion for Women Over 40, 50 &amp; 60 #FashionOver50 #TimelessStyle","Explore chic and elegant fashion for women over 40, 50 & 60. Outfits that convey sophistication, beauty, and timeless charm.",22,fashion
CAuMZPaiCgY,Ageless Over 60 Style Along the French Riviera 🌊 #over60style  #maturefashion #coastalelegance,,22,fashion
9IWzV_tRYgw,How clothes looks online VS Reality 😂,,23,fashion
TaVbf5y8E2I,Cortis - ‘FaSHioN’ Mirrored Dance Cover | #cortis_fashion,Follow me on social media! ☁️ @karinaavx__ ♡ Instagram: https://www.instagram.com/ karinaavx__/ ♡ TikTok: ...,24,fashion
iOVq25ZX73E,CORTIS Performs &quot;FaSHioN&quot; | iHeartRadio LIVE,"If You're New Subscribe ▻ http://bit.ly/1Jy0DbO CORTIS Performs ""FaSHioN"" | iHeartRadio LIVE ------------------------------ Listen ...",10,fashion
yqe6QimfmWI,Style 🔄 SWAP! #styling #fashion #1960s #StyleSwap #stylechallenge #aesthetics #angemariano #bffs,,26,fashion
U7edKBtYX04,which dress will you pick #jolipoli #fashion #runway #couture #model #fashionshow #hautecouture,Joli Poli Couture Spring 2026 | Barcelona Bridal Fashion Week.,22,fashion
kJSKfux2RFo,An easy fashion hack to make a top that’s too big fit you  #shorts,,23,fashion
DvfXPcIqDxE,CORTIS - FaSHioN (Lyrics),Follow the official 7clouds playlist on Spotify: http://spoti.fi/2SJsUcZ ​   CORTIS - FaSHioN (Lyrics) ⏬ Download / Stream: ...,22,fashion
qjPelVqFZeg,Guess who’s outfit is who’s (maximalist fashion edition) 🤔,,22,fashion
GuZiqstWfPI,How to Start a Fashion Trend 😘,,24,fashion
Ig7IS5k74sQ,NEWEST OCTOBER 2025 FASHION 🇮🇹 MILAN STREET STYLE | HOTTEST ITALIAN TRENDS IN AUTUMN OUTFITS LOOKS,NEWEST OCTOBER 2025 FASHION MILAN STREET STYLE | HOTTEST ITALIAN TRENDS IN AUTUMN OUTFITS LOOKS ...,19,fashion
OmSAgjPbNBI,"Elegant &amp; Timeless Italian Fashion for Women Over 40, 50 &amp; 60  #FashionOver50 #MatureFashion #Moda","Elegant Feminine Outfits | Timeless & Classy Style for Women Over 40, 50 & 60 Feel Confident in Chic and modest outfits ...",22,fashion
5rcDUW0zoqw,Popular clothes online vs. irl! #outfitideas #outfitinspo #outfitideas #lululemon #haul,,22,fashion
JD9J303Kxs0,[4K직캠] CORTIS - FaSHioN,2025.09.09 Twitter @radiombc Instagram @radiombc #CORTIS #코르티스 #COLOR_OUTSIDE_THE_LINES #COTL ...,10,fashion
auUwKMujn-M,what&#39;s with this walk? #fashion #model  #runway #ytshorts,,22,fashion
7PvjndwxpoM,Autumn Timeless Wardrobe Over60🍂#maturestyle #falloutfits #chicfashion #styleafter50 #timelesschic,,22,fashion
AGe_zn7dNCk,Which dress would you pick!? #prom #promdressshopping #formalwear #fashion #promdress #promdresses,,22,fashion
1iywu81r2nI,THE &#39;IT GIRL&#39; FASHION TREND THIS WINTER,,22,fashion
5dNxz9VmYq0,#beautifulwoman #prettywoman #ootd #fashion #dress #model #usafashion #streetstyleusa,,22,fashion
9bv0rBDxVrY,Sports You Never Knew Existed 👀,"Compilation of crazy sports within the world of Red Bull, including Red Bull Fierste Ljepper, Red Bull Slopesoakers, Red Bull ...",17,sports
JNYz4YdOgFk,Nothing beats a clean pass 😮‍💨 #athletics #worldathleticschamps #sports #uk,Subscribe to our channel - https://www.youtube.com/worldathletics ⭐️ Follow us on Twitter - https://twitter.com/WorldAthletics ...,17,sports
rNcMFBHikKc,Which sports should we do next? 😂,,17,sports
VgqwYnhpcxM,The biggest heart ❤️  #shorts #sports #tennis #tennisplayer #delpotro #cute,,17,sports
1af7esCt-Yc,Perfect pass 😤 #worldathleticschamps #running #sports #usa #relay,Subscribe to our channel - https://www.youtube.com/worldathletics ⭐️ Watch exclusive videos on Inside Track ...,17,sports
oenu2K8e6oU,weight loss exercises at home #sports #fitness #trending #home workout,,26,sports
sA_FtB4Etlg,When things don&#39;t go to plan 🥹 #athletics #sports #relays #japan,Subscribe to our channel - https://www.youtube.com/worldathletics ⭐️ Watch exclusive videos on Inside Track ...,17,sports
szeXkBYq5HU,Beach Bunny - Sports (Official Audio),"Official Audio for ""Sports"" by Beach Bunny Beach Bunny's album 'Emotional Creature' Out Now: ...",10,sports
EJrSji2JoGY,Top Sports Fails!😳,shorts #fail #sports Get ready to laugh and cringe at the same time with our compilation of the funniest and most epic sports fails!,17,sports
5rtUBGbhVpg,When every rep brought you closer to your gold medal. 🥇 #Olympics #Tokyo2020 #Sports #JavelinThrow,Re-live ALL the incredible #Paris2024 action: ➡️ https://oly.ch/P24Replays. #Paris2024 replays: ...,17,sports
k391xWc5K7I,Is it just us or are these coaches getting younger and younger? 🤭 🎥: @niadorner,Want to watch live sport and original documentaries for free? Check out our website: https://oly.ch/WatchLiveSport,17,sports
kSq5Gfj8PwU,LIGHTWEIGHT STRESSED WATCHING THIS🫣👀 #curling #sports #womenssports (via grandslamofcurling/IG),,22,sports
52iN7no-qpE,The MOST impossible finish in NBA history #shorts,"via @gdfactoryclips (TikTok) ✓ SUBSCRIBE, LIKE & COMMENT! ---- TikTok: https://bit.ly/3vwM3gn Instagram: ...",17,sports
Lx4Cjuv9YrQ,Bro got leveled 😬 (via @packmoneycf3),They don't play around in 37U football #football #footballhighlights.,17,sports
QjL7D33xpS4,Viagra Boys - Sports (Official Video),From the new album 'Street Worms' out 28th September: https://vb.lnk.to/streetwormsYD Listen to 'Sports': ...,10,sports
Pb2c0Bl7skE,Wind BLOWS ball back over net! 🤯,The moment the wind blew the ball back over the net in the match between Emma Raducanu and Yafan Wang in the second ...,17,sports
eTGDDaK3kK0,This sport looks tough 😱 (via @jaialaileague) #shorts,This sport looks tough (via @jaialaileague) #shorts ✔️ Subscribe to ESPN+ http://espnplus.com/youtube ✔️ Get the ESPN ...,17,sports
1yf7OzfPFiY,What in the world sport is this?! 👀 #shorts,,17,sports
qMzO9lL81Cw,Sha&#39;Carri making it look EASY 🏃‍♀️,"Sha'Carri Richardson showed off with a dominant performance at the NYC Grand Prix in June of 2022, winning the women's ...",17,sports
85_47gq35l0,Running Exercise Yogita Walker #shorts #running #motivation,Running Exercise Yogita Walker #shorts #running #motivation.,17,sports
Pgf5NUsDix0,The BEST entertainment in tennis! 😍,Mansour Bahrami is the most entertaining man in tennis and shows it in the exhibition match of the Australian Open. #Shorts ...,17,sports
ZiOCYldomx8,She couldn&#39;t BELIEVE it! 💫,Aryna Sabalenka's match point against Leylah Fernandez in Round 3 of the 2025 US Open. Don't miss a moment of the US Open!,17,sports
wAZ24Vt7Yuk,little emma conquering the vault. ❤️#Olympics #Gymnastics #ArtisticGymnastics #Sports,Want to watch live sport and original documentaries for free? Check out our website: https://oly.ch/WatchLiveSport 5 year old ...,17,sports
nXuNTjUkazQ,&quot;That&#39;s why live sport is better than Hollywood.&quot; 🤩,Re-live ALL the incredible #Paris2024 action: ➡️ https://oly.ch/P24Replays All eyes were on the track for the men's 1500m final ...,17,sports
K8UxsN6MlB0,He’s got that DAWG in him 🔥 #shorts,(via boomlumbus/IG) #football #truck #highlights #sports #littleleague.,17,sports
D09QkQ8Cyow,Bolt&#39;s first 200m gold! 😍🥇,Want to watch live sport and original documentaries for free? Check out our website: https://oly.ch/WatchLiveSport The king of the ...,17,sports
MP7Ea9qdBto,He wanted to swing. 💥 (📹: albertogonz50 / IG),Raked! Don't forget to subscribe! https://www.youtube.com/mlb Follow us elsewhere too: Twitter: https://twitter.com/MLB Instagram: ...,17,sports
sw1zfIApapk,Some sick skate skills! 🛹 🔥 @sisa_solymosyova,Video Credits: @sisa_solymosyova - Make sure to give her a follow! Want to watch live sport and original documentaries for ...,17,sports
xUfVnmu1vuA,1000 IQ play 🧠,smart #wnba #connecticut #basketball #IQ ✔️ Subscribe to ESPN+ http://espnplus.com/youtube ✔️ Get the ESPN App: ...,17,sports
Y_hdQXQfsNg,Sports - You Are The Right One (Official Music Video),Music video by Sports performing You Are The Right One Shop: https://merch.sportsbandok.com/ Buy the Naked All The Time on ...,10,sports
osb3HNKdQVY,"Extreme corner, unbelievable dive, outrageous splits 😮‍💨",,17,sports
FlZ-KGXkKVQ,Top 5 hardest sports in the world 🌎😳 #sports,,24,sports
nnrIDdB7FWw,Exercise at home #viralvideo #trending #strongabs #abs #fitness #sports #motivation #sports,,26,sports
trMIh3wsjDk,Setting up for the ultimate spike! 🏐🔥📹: shinjyo8888 #Olympics #Paris2024 #Sports #Volleyball,Re-live ALL the incredible #Paris2024 action: ➡️ https://oly.ch/P24Replays. #Paris2024 replays: https://oly.ch/P24Replays ...,17,sports
zCbbswzMIuA,"Hitting a $335,000 Gold Baseball",Solid gold baseball is impossible to hit. $2800 gold fix for $335000. We're asking for $360000 on TraxNYC.com #TraxNYC #Gold ...,24,sports
xP2sT-nUtM0,Soccer vs. Gymnastics 😂 #gymnastics #soccer #futbol #gymnast #sports #sport #fails #flop #olympics,,20,sports
_S-KnTnGgsY,How Cricket Changed Sports Forever,"If you're watching the 2023 US Open, you'll see an automated referee system called Hawkeye. More and more sports - tennis, ...",25,sports
ida4L5cG7d4,India&#39;s hurdle queen Jyothi Yarraji is up for the challenge at 38th National Games | RFYS,India's hurdle queen is on track to set the field on ! We're keeping our for Jyothi Yarraji to set a new benchmark at ...,17,sports
Guxqf_94I6M,Still can’t believe Shaq did this live 🤣,,17,sports
xNNSn2UVUHc,What kind of sports do you play?😝 #fypシ゚ #viral #shorts #sports #trending #challenge #volleyball,,24,sports
_lyAEL4Wqao,All Sports Golf Battle | Dude Perfect,Golf... minus the golf. ▻Click HERE for the Altered Course TV show! http://bit.ly/AlteredCourse Special thanks to Golf Channel for ...,17,sports
sMSFmnKGqqw,Peleteiro power 🔥 #spain #triplejump #athletics #worldindoorchamps,Subscribe to our channel - https://www.youtube.com/worldathletics ⭐️ Watch exclusive videos on Inside Track ...,17,sports
rQDwS4q4WNk,Women Beat Men In This Sport,"In most traditional sports, men tend to have a physical advantage. Part of that might come from the fact that men have historically ...",24,sports
NOfWPyYF-sA,Did We Just Invent A Sport? 🤔,Professional Red Bull freerunner Jason Paul takes on EHC Red Bull München ice hockey player Konrad Abeltshauser in a ...,17,sports
nCjUBkmrB60,Novak Djokovic&#39;s HUGE cricket shot! 🔥,Novak Djokovic changes out his cricket bat for a tennis racquet and hits a huge shot while playing with Jackson Warne and Steve ...,17,sports
U6HDxdeWipU,200m final all India University 2024 #200m #shorts #sprinter #trending #athlete #army #ytshorts #yt,,22,sports
jlrEpYqk3ho,You Have To Know About This Sport 🥶,Fierste Ljepper is a competition that takes place in the Netherlands where competitors have to vault across the canals to see who ...,17,sports
MjcRgRW_Peo,The Most Dangerous Sport in Athletics,,24,sports
HJInQGm2GgE,What a Race! 🇨🇦 #Paris2024,Watch all the #Paris2024 action LIVE! ➡️ https://go.olympics.com/watch #Olympics #Paris2024 #Olympics2024,17,sports
aHPpsQbuLQQ,couldn&#39;t have done it any better 😲 #masontaylor #jasontaylor #lsufootball #tigers #nfl #nflcombine,"Watch live local and primetime games, NFL RedZone, and NFL Network on Plus.NFL.com Check out our other channels: NFL ...",17,sports
RHtnrzct2RM,The latest Chinese technology trends are amazing,techno #short #technology #newphone.,25,technology
VnZG9Zi73wI,Others Technologia Vs TheLastOne 🤯💀,Others Technologia Vs TheLastOne #usashorts #technology #technologia #technologie #usacontent #skulledit #newedit ...,24,technology
qxRxcaPoYpQ,Top 3 most expensive and laxury mobile phone #tech #gadgets #short,"I'm going to tell you about three very expensive mobile phones that not everyone can afford, and they look very cool. Looking for ...",28,technology
rbyud9N4zPM,Revolutionary carseat technology #china #shorts #tech,,22,technology
ZSsrYRT99Yg,Samsung galaxy s23 ultra miniature unboxing 🤩🤩,,28,technology
_KIzFIgzuYQ,China’s Street Tech Looks Like 2050 🚀,"This invention from China proves they're living in 2050. Charging stations—some designed as benches, others as decorative ...",22,technology
IOVKA9eBzkw,New invention #scienceproject #inventions #technology #tech #shorts,scienceproject #schoolproject #technology #inventions #gadgets #ideas #science.,28,technology
gkklrVa8amY,The Most Futuristic Tech Of 2025.....,"Dive into the future with us at MWC Barcelona! We've uncovered tech that'll blow your mind, from earbuds that redefine audio to a ...",28,technology
eSucdOAIwrg,5 Most BRUTAL Tech Pranks Ever!,"shorts #tech #prank I spend a LOT of time trying to make my videos as concise, polished and useful as possible for you - if you ...",28,technology
4wZwXhoxRIA,15 Tech Gadgets I Use Every Day #shorts #justicebuys #tech,,22,technology
KCeEjhDMIv4,Samsung S22Ultra screen quality display. #Samsung #reel #reels #s23ultra,Instagram - https://www.instagram.com/techcave_ Copyright Disclaimer- Copyright Disclaimer under section 107 of the Copyright ...,28,technology
gsJAlLOFBv0,TINY Tech That Actually Works,,28,technology
vwTL0SLEl1M,The New Connector That Beats HDMI and DisplayPort 🤯,,20,technology
e92Y3yx9u-A,3 Weirdest Minecraft Tech Products,3 Weirdest Minecraft Tech Products.,28,technology
T-F-vVNVQ50,Coolest New Technologies of 2025,"Coolest DIY Videos ▻ @YouBuildDIY This year's tech unveils are redefining what's possible, blending creativity and innovation to ...",28,technology
RqMOyTUHDP0,College Tech Essentials,,27,technology
FelN4AKUfJI,Top 3 Best Useful Chinese Gadgets #tech #gadgets #short,I'm going to tell you about three Chinese gadgets that are useless to me but might be 100% useful to you. These gadgets look ...,28,technology
7uFrtqSwYzM,APPLE Glass Revolutionizes AR Experience Forever!,"Discover the revolutionary world of augmented reality with the Apple Glass! In this video, we dive into the sleek design, ...",28,technology
aDt7WrHTnYw,Other Technology vs The Last One 🧠💡| #edit #technology #newyork #usa,"Note: This video uses edited clips from a source, which I've credited below. If you're the creator of any clip and have concerns, ...",22,technology
Otim2mDjsYM,Top 17 New Technology Trends That Will Define 2026,"WATCH PART 2 HERE: https://www.youtube.com/watch?v=f-FyMY1LMwI&t=133s In this video, we reveal the top 17 breakthrough ...",28,technology
8SIcDkceVsw,When Technology Becomes Art #Meibot #future #robot #art #tech #technology,When Technology Becomes Art #Meibot #future #robot #art #tech #technology.,22,technology
iuLgq7bf6QY,New Innovation - 6 💥 #new #innovation #unique #tech #shorts,New Innovation - 6 #new #innovation #unique #tech #shorts.,26,technology
qqeZ5Hcw1Tg,Meanwhile Android 💀,trollface #troll #editing #trending #zqotiz #viralshorts #phonk #aura #sigma #explore #fun #funk #viral #edits #zqotizedits #shorts ...,24,technology
KArch4rjU_0,USB in USB #charger #technology #electronic #funny,Maybe stop plugging things into each other to see when they fail!!!,28,technology
F2abD5b7sGA,🤖&quot;AI Robo PHONE 📸 Future Technology😱 இது தான்!&quot;😮 but  @MrPalamOfficial ​,"Honor Robot Phone has a unique robotic camera arm that moves and swivels for perfect shots. It uses AI to sense, adapt, and ...",28,technology
lCHqmzynO-s,Overrated vs. Underrated Tech,Join my Discord server: https://discord.gg/gohar I'll edit your college essay: https://nextadmit.com/services/essay/ Get into ...,27,technology
nyjuAqhaPaE,New Toilet Technology! 🤣😂 (best animation memes) #shorts,,24,technology
ABw-VNs2hdM,Me from the #90s seeing computer technology from today. #nostalgia #90skids #millennials,,28,technology
mkcgVN90zl0,This Gadget BRICKS Your Phone!,shorts #tech #gadgets #socialmedia.,28,technology
xiv6IE915nc,30 year old IBM ThinkPad puts modern #tech to shame #pc #technology #shorts,This 30 year old IBM ThinkPad shows how important build quality is when it comes to making a laptop last. Back in 1994 this thick ...,28,technology
9H7v3aG2Exc,5 Most DANGEROUS Tech Products,Do consider subscribing to my Shorts Channel! Main Mrwhosetheboss YouTube Channel: ...,28,technology
h0xOdfMJTJI,This is future technology 2d animation #shorts,,1,technology
MBQBY9b6OAU,I Tested Every YouTuber Tech Product,I tested tech products from the biggest YouTubers. Go to https://surfshark.com/boss or use code BOSS at checkout to get 4 extra ...,28,technology
5fKkXFresYI,5 Times Tech has SAVED LIVES!,"shorts #technology I spend a LOT of time trying to make my videos as concise, polished and useful as possible for you - if you ...",28,technology
Uy7rP_rXzv4,Cleaning a Lenovo Legion laptop to fix overheating #tech #pc #technology #shorts,The Lenovo Legion is actually a great gaming laptop packed with high performance technology that's super easy to work on.,28,technology
kl9CvjeaddA,3 Tech Pranks to drive your friends Crazy 😂,Do consider subscribing to my Shorts Channel! Main Mrwhosetheboss YouTube Channel: ...,28,technology
2ru4Nsab94w,creators give tech hot takes,We ask @ZachsTechTurf @TechJoyce @nerdonabudget and @MachoNachoProductions for their tech hot takes!,28,technology
iPJfSknuO8I,I&#39;m the best technology moment ☠️,,22,technology
9Ztsy5EC6vk,Technologiya Bike 💀🏍️|#technologiya  #trolledit #sigmaboy,Technologiya Bike 🏍️|#technologiya #trolledit #sigmaboy @jps7r sigma boy sigma boy song sigma sigma sigma boy sprunki ...,24,technology
82jYblR16QM,4 times tech SURVIVED disaster,"shorts #tech #smartphone #gadgets I spend a LOT of time trying to make my videos as concise, polished and useful as possible ...",28,technology
i5R1Yxh0Kc8,Amazing Power Full Tractor Work In The Field #tractor #farming #automobile #technology #shortvideo,,22,technology
1Nef8LPO-jo,5 ILLEGAL gadgets that will get you ARRESTED,"shorts #technology I spend a LOT of time trying to make my videos as concise, polished and useful as possible for you - if you ...",28,technology
hL8tTeayfuA,Other Crazy Technology VS This One 💀☠️ #trollface #crazy #street #protection  #technology,Other Crazy Technology VS This One ☠️ #trollface #crazy #street #protection #technology.,24,technology
vfvQ-HRUm8Y,Why Did They Kill Your Childhood Tech?,shorts #tech #technology #techvideo.,28,technology
MBpIM7Ks-Tc,Cleaning a Laptop that&#39;s GROSS and overheating (HUGE Alienware FAIL) #pc #tech #technology #shorts,Disgusting Alienware laptop is overheating and needs a deep cleaning. A high performance computer like this Alienware M15 R7 ...,28,technology
De7s-IB_DAw,You&#39;re wasting money on Tech.,Leave a comment with how much this saved you :) Go to https://surfshark.com/boss or use code BOSS at checkout to get 4 extra ...,28,technology
obGieq1iv1k,Technology #technologia,,24,technology
PtyLfEo7yJs,Why I NEVER Recommend Gaming Laptops #tech #pc #technology #shorts,"What gaming laptop should I buy” is a question I get asked dozens of times a day, and my answer is always the same: Framework ...",28,technology
x23ACEzhARM,Technology Left The Room 😅😂,Technology Left The Room #mobilerepair #electronics #technology #soldering.,28,technology
s2OccJMWwkM,REAL vs FAKE Tech,The fakes were a LOT better than I expected Get the Insta360 GO Ultra: the best POV vlogging cam: ...,28,technology
xRbPAVnqtcs,[MV] BOL4(볼빨간사춘기) _ Travel(여행),[MV] BOL4(볼빨간사춘기) _ Travel(여행) *English subtitles are now available. :D (Please click on 'CC' button or activate ...,10,travel
mkfSZDwAaf8,Place On Earth That Don&#39;t Feel Real #travel #explore #expectations #adventure #shorts,Place On Earth That Don't Feel Real #travel #explore #expectations #adventure #shorts.,22,travel
5sj48CRQvTg,I Found The Most Beautiful🥰💞✨ Place On Earth#travel #beautifulworld #nature #adventure#explore,I Found The Most Beautiful Place On Earth!#travel #beautifulworld #nature #adventure Join me on an unforgettable journey to the ...,19,travel
o9esB3n-GAw,3 Beautiful Swiss Villages That Left Me Speechless (Switzerland’s Heaven!),"Three amazing Swiss locations in one peaceful walking tour: Sonogno, Grindelwald and Lauterbrunnen. Join me for a slow ...",19,travel
6dci0QI4oHI,ウズベキスタン旅行🇺🇿シルクロードを巡る8日間の旅｜青の都サマルカンド｜ヒヴァ｜ブハラ｜タシケント｜中央アジア,初めてのウズベキスタンを８日間で旅してきました  砂漠の古代都市ヒヴァから始まり、500年前のバザール・ブハラ、青の都 ...,19,travel
YZ9kdU76s3w,Switzerland’s Most Beautiful Train Ride – Grindelwald to Lauterbrunnen,"Important - turn on subtitles in your native language in the settings - ""CC"" For the best viewing experience, watch on a smart TV ...",19,travel
7Wjn7Ga-MD0,Toddy Tapping in Kerala | EP - 02 | Kumarakom Getaway | Puthettu Travel Vlog |,puthettutravelvlog #jelajaratheesh #puthettutravelvlog #jelajaratheesh 1.Through Kerala https://youtu.be/ME1of95eKyw 2.,19,travel
KkMiG7n-tgE,３Days Across Europe on the World’s First Capsule Sleeper Train! | Netherlands 🇳🇱→Germany 🇩🇪→Italy 🇮🇹,"Today, we ride Europe's first capsule sleeper train on its newest route, enjoying the sights and the local cuisine. Train: OBB ...",19,travel
Uco42O6VF2U,The Reality of Travelling While Brown in Europe #genz #travel #montenegro,,26,travel
9oZVMcF55tQ,UNSEEN WONDERS | Hidden Places Even Locals Can’t Believe Exist | Travel Video 4K,"UNSEEN WONDERS | Hidden Places Even Locals Can't Believe Exist | Travel Video 4K Some places are so well hidden, even ...",19,travel
DQz21NBBdgg,Places that Don&#39;t feel Real on Earth😍 #travel #beatifulnature #beautifulworld #travelshorts,places that don't feel real #explortheworld #travelshorts #beautiful Copyright Disclaimer: - Under section 107 of the copyright Act ...,19,travel
Ab3mkNFdujs,Watch this if YOU’RE SCARED to TRAVEL ALONE 😖,,19,travel
c21q2lJEegw,ALASKA: Russian America | Travel Documentary 4K,"From the first Russian explorers who crossed the Bering Strait to the gold-seekers of the Klondike, Alaska has always drawn those ...",19,travel
ILJkRQwhDec,That&#39;s the Way It Is - Music Travel Love ft. Bugoy Drilon,"Merch https://www.musictravellove.com Get ""That's the Way It Is"": Smart URL: https://lnk.to/BQPWLXy3 Spotify: ...",10,travel
KBNHqI4kono,50 Most Beautiful Places To Visit In Europe | 4K Travel Guide,"An extraordinary journey through Europe's wonders in 2025, captured in magnificent 4K footage that will transport you from the ...",19,travel
22wkPKbnm8o,Craziest travel vlog EVER 😭,,23,travel
MldBR6KPu1c,Dollar Tree Travel Dupes #lifehacker #lorafied #hack #travel,,26,travel
yHr29IpYpRU,flying home to build our VAN #hindi #travel #airport,"the past week has been amazing in Vietnam, we have loved it here! But NOW we are flying home because we are so excited to ...",26,travel
-QAk34mE1NE,Most beautiful 💖🥰💕 Place on the earth 🌎 #shortsfeed #travel #world #beauty #exploretheworld,"""Traveling the world is not just about visiting places, it's about experiencing cultures, creating memories, and discovering yourself ...",22,travel
ECjQHyNoZhk,Birthday Trip to LONDON 🇬🇧 | Epic Transition Reel + Travel Vlog Reveal | Niharika Jain,"It's finally here—the BIG reveal ✨ My birthday trip to London I've been waiting to share this with you all, and what better ...",22,travel
