video_id,title,description,category_id,keyword
Oy2QyPQ5L5M,Max Amini FULL COMEDY SPECIAL 2025 | &quot;Randomly Selected&quot; | Stand Up Comedy,"You've been randomly selected in my shows, now prepare to be Randomly Selected in your homes! Max Amini's comedy special ...",23,comedy
HVJc9PuhklE,😆Dumle 🧨twsit comedy👊🏻🤣 #shorts #diwali #fun #viral,,22,comedy
KO5gqG41-cg,Wet &amp; Cold | Zoltan Kaszas | Stand-Up Comedy,"Comedian Zoltan Kaszas performs to a sold-out crowd in Tacoma, WA at the Tacoma Comedy Club. TOUR DATES: ...",23,comedy
QgCFvMQ45Y4,Lucknow dilli me room lene jao to..😂 #comedy #anandraja #comedyvideos #funny #shortvideos,,23,comedy
H71hq8R7bKs,मम्मी हुई प्रेगनेंट #shortvideo #funnyvideo #comedy,,23,comedy
21Spm_DztWg,Don’t miss end😂🤣 #aamavaa #slang #funny #tamilcomedy #funnycomedy #entertainment,,24,comedy
m-_jvZVx3WE,“White Parents&#39; Punishments” 🎤: Shapel Lacey - #comedy #shapellacey #donttellcomedy #shorts,Subscribe to our channel and check out the full set from Shapel Lacey! http://bit.ly/dtcyoutube Get on our secret email list at the ...,23,comedy
BJkcU3hkh4I,SIM🤣#Simcomedy#funnyvideo#tamilbestcomedy #funnyvideos#viralshort #funny#comedy#trendingshorts#trend,funnyvideo#tamilbestcomedy #funnyvideos#viralshort #funny#comedy#trendingshorts#trend ENNA KATHAI என்ன கதை ...,23,comedy
UDb0rtJ7hR4,Funniest Fun New Comedy Video 2025 😂 2025 Special amazing funny video 2025 Episode 200 By Doctor x,"Funniest Fun New Comedy Video 2025 2025 Special amazing funny video 2025 Episode 200 By Doctor x Hello Dear Viewers, ...",24,comedy
gjxkwF6Vas4,Must Watch New Comedy Video 2025 Amazing Injection Wala Comedy Video 2025Top New Doctor Comedy E-467,ourfuntv #injectionfunnyvideo #sui_wala Must Watch New Comedy Video 2025 Amazing Injection Wala Comedy Video 2025Top ...,24,comedy
X0D8BHRXssg,क्रिकेट वाला वीडियो ||🤣🤣🤣|| Lucky Comedy #shorts #trending #viralvideo,रिकेट वाला वीडियो ||      || Lucky Comedy #shorts #trending #viralvideo #Cricket wala Video #Gaon ka cricket ...,23,comedy
RFE5zAAWsyk,#sonumalang #comedy 😂😂😂,,22,comedy
zmSTBkkVT00,school 🤣#funnyvideo#tamilbestcomedy #funnyvideos#viralshort #funny#comedy#trendingshorts#trend,funnyvideo#tamilbestcomedy #funnyvideos#viralshort #funny#comedy#trendingshorts#trend ENNA KATHAI என்ன கதை ...,23,comedy
VDasu932SpE,❤️ #panamatta #comedy #comedymoments #tamilmusic #funny #comedyking #tamilsong #love,,23,comedy
Hrm9r59TrAg,school comedy 🤣#funnyvideo#tamilbestcomedy #funnyvideos#viralshort#funny#comedy#trendingshorts#trend,funnyvideo#tamilbestcomedy #funnyvideos#viralshort #funny#comedy#trendingshorts#trend ENNA KATHAI என்ன கதை ...,23,comedy
YPnxF-gS0vg,देहाती दिवाली || Dehati Diwali - Comedy Video || Ankit Jack Vines,Thanks for Watching Dehati depawali Subscribe to Our Comedy Channel - https://www.youtube.com/@AnkitJackVinesYT I ...,23,comedy
wXMZCUFM_O4,Chalaa goli😂 #shorts #funny #comedy,,23,comedy
ZXC0DDdaDUA,வாழைப்பழம் 🤣#funnyvideo#tamilbestcomedy #funnyvideos#viralshort #funny#comedy#trendingshorts#trend,funnyvideo#tamilbestcomedy #funnyvideos#viralshort #funny#comedy#trendingshorts#trend ENNA KATHAI என்ன கதை ...,23,comedy
d2K4QHZgxvc,जब मैं भूल जाती हूं कि मैं ससुराल में हूं 😜🤣 Comedy Shorts #trending #viral #funny #shorts #comedy,जब मैं भूल जाती हूं कि मैं ससुराल में हूं Comedy Shorts #trending #viral #funny #shorts ...,22,comedy
C8xfUxKnB8E,😱Watch till End…💯😍🤣#shorts #jasvikamedia #youtubeshorts #comedy #fun #ytshorts #trending,,24,comedy
n_QyiirlP3c,Diwali dhamaka video 🤣 amit comedy video #2023 #comedy #comedyshorts #trending #funny,,23,comedy
yU5130kNDB8,Gussa mat karo medam😂 #shorts #funny #comedy,,23,comedy
8LCk5VNa0E8,bacha loge to khana banega...🤣 #comedy #funny #shorts,,23,comedy
OLGrx-m-0iA,2 Hours of All Killer Comedy | Stand-Up Comedy Compilation,2 hours of comedy you can't walk away from. Enjoy! Comedians in order of appearance: 0:00:00 Chad Daniels - Twelfth Night ...,23,comedy
hQQQZTcyB44,The End 😂😂 |Indian family #shorts #indian #chotabhai #school,The End |Indian family #shorts #indian #chotabhai #school.,24,comedy
txN_qF7Sk6k,Unfiltered Matt Rife Comedy | Matt Rife Viral Crowd Work Moments,In these 47 minutes with Matt Rife he talks to his audience about a variety of topics ranging from being gay to ghosts. Watch now.,23,comedy
Kl5eYoqKxVw,#sonumalang #comedy 😂😂😂,,22,comedy
-epmYu2XUGU,Sujiiii shocked 😳 #trending #funny #srinisuji #comedy #tamilcomedy #dreamcouples #mamiyarmarumagal,Sujiiii shocked #trending #funny #srinisuji #comedy #tamilcomedy #dreamcouples #mamiyarmarumagal #ammacomedy ...,22,comedy
PMGWVyM2NJo,Ryan Sickler: Live &amp; Alive | Full Comedy Special,"Ryan Sickler's new standup comedy special, LIVE & ALIVE, is a raw, hilarious, and deeply personal look at surviving a near-death ...",23,comedy
yZPSfbbMkDQ,நலம்தானே..🤕👍..💯twist comedy..🙏🏻🤣🤣 #shorts #funny #comedy,Thanks for support and love ❤️        …   உங்களின் அன்பிற்கும் ஆதரவுக்கும் ..             ...,23,comedy
qbXE6iZFuNE,उपाय ग़लत था क्या 🤪🫣😂#viralvideo #viral #shortvideo #funny #comedy #shorts,viral #viralvideo #viralshort #viralshorts #shorts #shortsvideo #youtubeshorts #short #shortvideo #youtubeshort #love #funny ...,24,comedy
g5f-Zs3OCyE,Magic 😱💥🤣 #shorts #magic #comedy #tamil,,22,comedy
EV6ONJP68r4,Jo kharidna he kharid behan😂 #shorts #funny #comedy,,23,comedy
xUDg5HL1GAA,Lablabahiya bua😂 #anandraja #comedy #funny #shorts,,23,comedy
tOqlu6SqnwU,पत्नी VS पति 😜🤪 Comedy Shorts #comedy #funny #trending #shorts #youtubeshorts,"पत्नी VS पति Comedy Shorts #comedy #funny #trending #shorts #youtubeshorts Keywords:- keshav shashi vlogs, ...",22,comedy
c1WckZi-mPQ,kalti Girlfriend 🤪!!@sabfyen #shorts videos,,22,comedy
HdOKqgAV7JA,Wait for the twist 😂 #comedy #comedyvideo #shorts #youtubeshorts #funny #funnyvideo,,23,comedy
0nTzRag1hWc,Unga mama ipadi thana ? #shorts #shortvideo #shortsfeed #trending #funny #comedy #money #like,,24,comedy
HxqERkwuttc,LAUDE FAMILY VACAY: Visiting the Google &amp; Youtube Office in Singapore with the boys! | Small Laude,"SmallLaude #Singapore #Google Don't forget to like, comment, and subscribe for more vlogs! OF COURSE! NO BASHING!",22,vlog
AslrG6AaxYs,BANGUNGOT,We survived Nightmares Manila! Jump scares. Real screams. Real chaos. Watch 'til the end #PambansangYobab ...,24,vlog
47eBCFnNAnc,【vlog】休日3日間の過ごし方⋆⭒˚.⋆セリア購入品🤍セルフネイル💅🏻iPhone17📲♡,今日も見てくれて本当にありがとうございます  ♡！ 提供：CASETiFY 下記のリンクからの購入で15%OFFになります！,22,vlog
_jsoTxhJ7UM,Street Grocery by Alex Gonzaga,Subscribe to Ka-maintenance https://youtube.com/c/BonoyPintyGonzaga For business please contact me!,22,vlog
8wLlMg9ZdXs,VICEION: Happily SEVEN After! | VICE GANDA,Ganda ka? Edi subscribe na sa aking YouTube channel para updated kayo sa aking mga chikahan at ganap!,23,vlog
-6mDM9Ddiz0,My first Experience on Electric Bike ||Mustang Day1 || #yadea || MRB Vlog ||,For Business Enquiry ▶️ mrbvlog3803@gmail.com Check out Taptap Send: I use it to send money to Nepal. Get it at ...,19,vlog
8CW9gKdYMQw,Ruchika ka birthday celebration ,,22,vlog
UWugPc2SH9I,Haram Sharif 🕋 | Clock Tower Mall ⏰️| Albaik🍗 | Makkah Vlog ,Haram Sharif | Clock Tower Mall ⏰️| Albaik   | Makkah Vlog | Sadim Khan | Maria khan | Umrah ...,22,vlog
nyhO-9pkrxo,CARWASH GIRLS WITH RUFA MAE | IVANA ALAWI,Follow me! Instagram: @ivanaalawi https://www.instagram.com/ivanaalawi Twitter: @ivanaalawi ...,22,vlog
8NLU8sOeKQc,Sold My Parents&#39; Car Prank by Alex Gonzaga,"Download TAPTAP SEND and use my code ""ALEXG"" to get additional $20 on your first send to the PHILIPPINES!!! click the link ...",22,vlog
Zn7-NsmJd-8,VLOG DE NOTRE SEMAINE À LONDRE [ UN VOYAGE INCROYABLE COMME NOUS ;) ] ,Voyagez avec nous les chéries.,1,vlog
Dxtx0moWP64,HOUSE TOUR VERSION 2.0 (Galing sa pagod at hirap!!!),"Sa mga nakakakilala sakin, alam nila na hindi ako nag ha-house tour ng hindi sakin talaga na bahay. This time version 2.0 na ...",24,vlog
hf4aXQjK4Kc,"VLOG: НАКРЫВАЮ СТРАШНЫЙ СТОЛ! БОРЩ, ПАМПУШКИ! 🤤 01.11.25",Наш телеграм: https://t.me/katylifevlogs НАШ КАНАЛ SWEET HOME https://www.youtube.com/c/SweetHomeKB МОЙ КАНАЛ О ...,22,vlog
3YYbGnzzFqY,"VLOG | НОВЫЕ КОСТЮМЫ, УКЛАДКА ВОЛОСЫ, ПОКУПКИ ДЛЯ ДОМА, РАСПАКОВКА ПРОДУКТОВ",Артикулы вб : Полотенца серые 223684137 Полотенце белое 175135894 Попкорн 18380488 Емкость для масла ...,22,vlog
C7aNsBYkmio,Allison Laude Visits her CMC Friends in Europe! VLOG TAKEOVER! | Small Laude,"SmallLaude #AllisonLaude #Europe Don't forget to like, comment, and subscribe for more vlogs! OF COURSE! NO BASHING!",22,vlog
sfq538kGC48,In OCTOBER 💛 - A Lagos Vlog | Work | Events | Shoots | Fun | Life of Beautypreneur ,"Whewww October was a MONTH! From my The Shine Cartel's first pop up to getting settled in Lagos from Japan, to events, brand ...",22,vlog
VnRA2XFhKoo,Daily Vlog නුවර ගෙවෙන ලස්සන දවස් 🌷💗✨ Living Alone | Cooking |Cleaing #aestheic #vlog ,"I'm Minoli Disanayaka! Welcome to my channel, If you're looking for honest, relatable vlogs filled with laughter, life lessons, ...",22,vlog
AoK9_DcG4CA,"Slow Days, Picnic Date &amp; Shopping Haul 🧺🍃",WATCH IN 4K ♡ Follow me: ❀ instagram: kiannady ❀ twitter: kiannady ❀ facebook: KimKiannaDyOfficial ❀ tiktok: kiannady_ ...,22,vlog
kaPgGH5HC0w,a week in my life vlog,"I partnered with Coach to take you through a week in my life—featuring the Teri bag, a staple that just fits effortlessly into my ...",24,vlog
hrYdalQUXVI,BMIC VLOG DAY-2 || COMEBACK????,"Welcome to the real side of Soul Aman – unfiltered vlogs, raw moments, and stories straight from my life. Let's live it together!",22,vlog
ANEcHbfRJP8,Introducing my husband to Palawan’s breathtaking beauty | Married Life Diaries,BGM Sources Nap time ⁦https://youtu.be/zclShK1hBfg?si=GHfg0tOgdvm1E8sz⁩ Celery in a carrot field ...,22,vlog
9eJNGKxKENg,"MOVING IN to my FIRST EVER APARTMENT + TOUR ♡📦 organizing, building &amp; hauls (moving diaries EP.4)",୨୧⋆｡⋆ ♡ * MOVING VLOG! i know you guys all want to get a glimpse of the place so bad and trust me I WANT TO SHOW ...,22,vlog
TZ0Hv1qtd-0,ISANG ARAW NA TATAY,"SERGEYBIN #ISANGARAWNATATAY Exclusive Capinpin Bros. Aquaflask, available now in the market! ⬇⬇⬇ ""Tiktok Shop"" ...",24,vlog
CO3Lqqu4Sm8,Soham ne he Kay dil gift 😂😱🤣|| bhaubij vlog ❤️,Thanks For Watching friends❤️❤️ Follow me on Instagram-https://www.instagram.com/mr.,20,vlog
1FVLBwfMGOg,1 HORA DE VLOG NA PRAIA E NO PARQUE NOS EUA!!!,"YOHA, viva sua melhor versão https://vivayoha.com.br/ ATENÇÃO ESTE VIDEO É MERAMENTE PARA ENTRETENIMENTO E ...",24,vlog
c3dIiwN6h9k,Korku Evi Vlog. Ecrin Su Çoban &amp; İlke Susyal &amp; HÜSO,"Arkadaşlarım, Zeynep, @ilkesusyal ve kardeşim @huseyinerkincoban ile birlikte korku evine gittik. Parkurları çözmek ve devam ...",22,vlog
WXj9BSYnA8c,"［vlog］10月の日常ブイログ🧸一人暮らしの社会人オタク 漫画の整理,購入品紹介,zb1コンサート参戦,京都旅行 etc..(sub)",ご覧いただきありがとうございます   Thank you for watching *:･ﾟ✧*:･ﾟ✧ ✧ instagram ...,22,vlog
hvHGEuIiNCI,限界jc夕方のVlog🌇🫶🏻🤍#生活音 #コスメ #jc #中学生女子 #vlog #fyp,,22,vlog
mPByeXimcNg,FOOD TRIP SA QUIAPO WITH MIKA &amp; BRENT | IVANA ALAWI,Follow me! Instagram: @ivanaalawi https://www.instagram.com/ivanaalawi Twitter: @ivanaalawi ...,22,vlog
XxxWc6_HZls,Kanchi Exposed Mini Vlog 😍 - #minivlog #MiniVlogs #sonuvlogs #shorts #ytshorts #entertainment,Kanchi Exposed Mini Vlog - #minivlog #MiniVlogs #sonuvlogs #shorts #ytshorts #entertainment vlog vlogs mini vlog mini vlogs ...,24,vlog
q4dpEahWtNA,"Ulaanbaatar diaries (Halloween🎃, айлд зочлов, unboxing)",,19,vlog
VY-AsEgHshs,PERIODS PRANK ON RAJJU 🥺 #rajjufam #vlog #vlogger #rishabkhan #india #vlogvideo #video #lovestory ,rajjufam #vlog #vlogger #trending #foryou #trending #love #vloggerlife #rishabkhanvlog #rishab #shivifam #sahinakhan ...,24,vlog
Pq0ZsHejwVc,"Zara a Temu nákupy, narozeninové dárky | VLOG","V dnešním vlogu je opravdu hodně novinek, tak jukněte. Kafíčko nebo čaj nutné :-D Odkazy na produkty: - Bioxcin ...",22,vlog
XFoJTTwwy5g,Saturday morning vlog ✨,,27,vlog
08PHNJsXrIc,weekly vlog | new nyc apartment + tour +photoshoot +diwali +home shopping &amp; more | allyiahsface vlog,Hi hoochies! what an insane week... lol as always everything is linked below for you! Shop my perfume here!,22,vlog
5jYpHocWRF4,Porto la masato a brickel + festa in barca - vlog day 12,Non dimenticate di seguirmi sui miei altri social per rimanere attivi durante tutta questa esperienza     insta ...,24,vlog
T_PfdVSo3Zk,Fantasy Park Vlog - அடேங்கப்பா இங்க இவ்ளோ இருக்கா 😍😍,Fantasy Park Mini Vlog - அடேங்கப்பா இங்க இவ்ளோ இருக்கா #Vlog #travelvlog #palakkad ...,22,vlog
_ewWfZda5jo,Our First Vlog as Husband &amp; Wife....,Hope you all have an awesome & safe week !! ---------------------------------------------------------- Email: ...,22,vlog
0wA3-tDNthw,Lagta ha gymnastics choose kar ka ghalti kar di #minivlog #ibrahimvlogs #vlogger #vlog,Lagta ha gymnastics choose kar ka ghalti kar di #minivlog #ibrahimvlogs #vlogger #vlog #youtubevloggers #instagramtv ...,22,vlog
Wf7qqiJRv1E,Raat ke 2 baje maggi ki craving😭😝#shorts #minivlog #vlog,,26,vlog
JqWJyLvLazo,🏡❤️ ROTINA DE PAI SOLO - ATUALIZAÇÃO SOBRE A GELADEIRA #vlog #cozinha #vlogcomigo #receitas,,22,vlog
CoieFLMP8Vc,夜投稿のvlog伸びるかな #コスメ #人気になりたい #サンリオ #生活音初心者 #素材収納 #メイク #vlog #ダイソー #シール帳 #シール,,22,vlog
ubft8Enjf60,NEGOSYANTE NA SI LASSY (TARAY TWO BUSINESSES AGAD AGAD),Subscribe na rin kayo sa channel ni Beks Chad: https://www.youtube.com/user/chadkinis Follow us! FB: http://bit.ly/beksbfb ...,23,vlog
edXQogBLDxc,Durga Ashtami mini vlog #youtubeshorts #grwm #ytshorts #shorts ￼,,22,vlog
g_h-yCk-y8E,"living alone vlog in NYC 🚕  grocery restock, home-cooking, productive days",the living alone vlogs are soooo back babyyy! ✩ MY SOCIALS ✩ business inquiries only: viaa.ilyou@gmail.com second youtube ...,26,vlog
TjIxYxE0fxI,VLOG: PREZENT NIESPODZIANKA OD MOJEGO MĘŻA!,"Cześć! W dzisiejszym odcinku zabieram Was ze sobą na luźny dzień ze mną. Zobaczycie ⁦m.in⁩ pilates z moją przyjaciółką, ...",24,vlog
klHpUmhaCoU,"FALL SHOPPING VLOG 🍁 | huge fall clothing haul, new wardrobe + outfit inspo",Try RYZE Mushroom Coffee for yourself! Head to https://ryze.yt.link/hm3ZDHj and use my code LEXIVEE15 to receive 15% off ...,26,vlog
FoPpLnuoSLM,সুন্দরবন ভ্রমণ মাত্র ৩৩০০ খরচে থাকা খাওয়া ঘোরা ফ্রী #vlog #youtubeshorts #youtube #shorts #tour,"সুন্দরবন ভ্রমণ সাথী travels ---- package মাত্র ৩৩০০টাকা তিন দিন দুই রাত থাকা, ...",22,vlog
sTjfSTf2avs,Bà Tân Vlog - Lần Đầu Làm Mâm Vịt Nướng Vân Đình Khổng Lồ Đãi Cả Làng,Bà Tân Vlog - Lần Đầu Làm Mâm Vịt Nướng Vân Đình Khổng Lồ Đãi Cả Làng Bà Xin Chào tất cả các cháu hôm nay Bà. Lần Đầu ...,24,vlog
VIve_FTE_48,"ireland vlog 🇮🇪 my husbands first time in dublin, howth day trip, wicklow sheepdogs, trinity college",Use my link or QR code to try 60 days of Headspace for free: https://headspace-web.app.link/e/cari25 (code: CARICAKES25) ...,22,vlog
iB6UqtflB0Y,5 Foods That Clean Your Arteries Fast! #health #wellness #healthtips,Discover how incorporating more healthy food into your diet can help maintain optimal heart health and prevent blocked arteries.,22,health
Rt9WZ-CGcJA,Intestines Slowed by Sitting Long Hours Animation | Gut Health | Human Anatomy | Stomach AI Art | 08,Viral endoscopic footage reveals the disgusting truth: Your 9-5 desk job is rotting your intestines! Watch real-time footage of ...,1,health
d8_YZ7QVQlQ,TEARS,"Provided to YouTube by IIP-DDS TEARS · HEALTH TEARS ℗ Rockstar Games Released on: 2012-01-01 Composer, Lyricist: ...",10,health
F6D6rOYn-2M,FEEL NOTHING,Provided to YouTube by Universal Music Group FEEL NOTHING · HEALTH VOL. 4 :: SLAVES OF FEAR ℗ 2019 Loma Vista ...,10,health
OUfkPc-Fkxk,Illustration of Constipation Moving | Gut Health | Anatomy Art USA,Speed through the human digestive tract with AI-powered visuals and smooth narration. Great for last-minute reviews and ...,27,health
_cMGLMQ1Fko,The REAL REASON they won&#39;t cover Trump&#39;s health?,"Jonathan Karl, Chief Washington Correspondent for ABC News, joins us to discuss his new book “Retribution: Donald Trump and ...",25,health
8pel6PAEukM,How are chocolate cysts formed? #health#didyouknow#shorts#funny#trending,,1,health
yMN7b0lEqXY,Healthy Food #foodismedicine #healthyfood #proteinfood #diet #bestfood #weightloss #shorts #health,,22,health
JcYf_GNIX3Y,HEALTH :: CYBERPUNK 2.0.2.0.,HEALTH - CYBERPUNK 2.0.2.0. DISCO4 :: PART I OUT NOW: http://found.ee/HEALTH_DISCO4 CYBERPUNK 2.0.2.0.,10,health
YhHHJ3MgtJU,WHAT I EAT IN A DAY #diet #nutrition #caloriedeficit #whatieatinaday #health #fitness #healthylife,,22,health
t9lNonmqmOY,Smoking kills #doctor #drrazahealth360 #medical #health #healthtips #smoke #lungs,"Smoking kills Human Anatomy!"" Ever Wondered What's Inside Your Body? In this video, Dr. Raza takes you inside the human ...",27,health
ic3VsVlNxDk,9 HEALTH WARNING SIGNS REVEALED BY LOOKING AT YOUR NAILS! #shorts,"In this video, I share everything you need to know about warning signs revealed by looking at your nails! I trust these information ...",27,health
LTtc7WMtcGs,Warning Signs in Your Feet!,Are your feet trying to tell you something? Most people overlook these common foot symptoms—but they could be early warning ...,27,health
-weqbNoruG0,One Drink That Flushes Out Toxins Overnight! #health #wellness #healthtips,Start your day right with this simple morning routine that supports liver function! Drinking warm lemon water with turmeric helps ...,22,health
luWCuqid4l8,The #1 WORST Drink For Your Liver,"You've heard that soda, beer, and wine are bad for your liver. But what if I told you there's a drink even MORE dangerous… and ...",27,health
Xs_7oSNTEXQ,What exactly is hydrocephalus?#animation #funny #shorts #health #trending,,1,health
LSDYoqXS_fA,Avoid This &quot;Healthy Food&quot; SCAM,NEW: Join us at http://www.icedcoffeehour.club for premium content - Enjoy! Add us on Instagram: ...,27,health
RC1919tTab0,The truth about men’s mental health…#shorts,,22,health
-tvl8sDu9vo,HEALTH :: ORDINARY LOSS,"ORDINARY LOSS FROM ""CONFLICT DLC"" :: OUT DECEMBER 11 2025 https://i.hlth.band/conflictdlc DIRECTED BY ...",10,health
ArBkPRztJ88,The 9 Spices That Actually Heal Your Body  #health,Eat turmeric to fight inflammation and ease joint pain. Cinnamon helps reduce sugar cravings and control blood sugar. Ginger ...,27,health
NhxiNNi_p2k,These hospital prices in Türkiye broke my American brain #health #wellness #healthtourism #turkey,"We wrote an entire article about what's included in the checkup packages, and how we booked that's linked on my profile ...",19,health
ym7hlcqg7LQ,The Top 10 Eye Healthy Foods | Eye Health,Top 10 Eye-Healthy Foods to Improve Vision and Prevent Eye Diseases: Your eyes work hard every single day—so giving them ...,27,health
dpnbPpjWRR0,Top 3 Foods to Prevent Leg Cramps in Seniors: Strengthen Your Legs!,LegStrength #SeniorHealth #HealthyAging #Health365 Timestamps : 0:00 Intro 0:57 Eggs 7:50 Banana 13:49 Nuts and Seeds ...,27,health
EEf3Q0l_DeA,மக்கள் வயித்துல அடிச்சு பொழைக்கிறது சரியா😡 | Star Health Insurance | Before You Buy Health Insurance,நமது ஆரோக்கியமான Aurawill சத்துமாவு வாங்க இந்த Link-ஐ கிளிக் செய்யவும்: ...,24,health
dIzz0iEHPns,#shorts 5 Best Cooking Oil #health #healthylifestyle #nutrition #oil #doctor #cooking #food,,27,health
40vsRU9V1h8,HEALTH x PERTURBATOR :: EXCESS,FROM DISCO4 :: PART II :: STREAM + PRE-ORDER HERE :: https://found.ee/HEALTH_DISCO4PTII YOU WILL LOVE EACH ...,10,health
DkS1pkKpILY,"What Alcohol Does to Your Body, Brain &amp; Health","In this episode, I discuss the physiological effects that drinking alcohol has on the brain and body at different levels of ...",28,health
UHzsRtsBEOs,Avoid Junk Food Temptation #short #shorts #youtuber #fitness,,22,health
95ovIJ3dsNk,How childhood trauma affects health across a lifetime | Nadine Burke Harris | TED,Childhood trauma isn't something you just get over as you grow up. Pediatrician Nadine Burke Harris explains that the repeated ...,28,health
GB6mVRsFzBM,Mending Toes: A Doctor&#39;s Approach to Brachydactyly#animation #funny #shorts #health,,1,health
9IUFIDXp5w4,🚨Trump&#39;s New Health Reveal Just STUNNED White House Insiders,A key White House staffer just MOCKED Trump for the WORST reason! David Reddish ▻ INSTAGRAM: ...,24,health
CzId0K4iv8E,🚨Trump’s Health DETERIORATES FAST as he VISITS HOSPITAL,MeidasTouch host Ben Meiselas reports on Donald Trump's suspicious visit to Walter Reed Hospital as the White House claims ...,25,health
xLeJ0EbHTpk,Daylight saving time and your health,ABC News' Dr. Tara Narula explains how the time change can impact on health. SUBSCRIBE to GMA: ...,24,health
R-LvrytY6aA,Do This in the Morning to Improve Gut Health...┃Andrew Huberman,Video idea goes to @wisemind101 Health Lab : #shorts #hubermanlab #shortsfeed #neuroscience #lifestyle #science #brain ...,22,health
kxgO_zUt29A,"Health insurance premiums set to skyrocket this year, Senator Durbin warns",Illinois Senator Dick Durbin sounded the alarm on rising health insurance premiums in Illinois on Friday. NBC Chicago's Charlie ...,25,health
fSXqNiuWHZ4,"MIRACLE! 1 Leaf DESTROYS DIABETES, Bad Cholesterol and FAT BELLY! | Senior Health","Could one simple leaf really fight diabetes, lower bad cholesterol, and melt stubborn belly fat? In this powerful senior health video, ...",27,health
7lIwM43meNE,When Asian Parents Finally Care About Mental Health,,24,health
oRZgtMPUcyo,What Happens If You Drink Cucumber Lemon Water Daily?,"Have you ever wondered what would happen to your body if you drank cucumber lemon water every single day? In this video, we ...",27,health
fgJdRiPct60,How Does Ibuprofen Find Your Pain? The Science Explained! #shorts #animation #webtoon,,22,health
kRCjZ5q8a58,The shocking truth about stomach explosions#animation #funny #shorts #health #trending,,1,health
2-5-x6YsQJU,My Top 3 Supplements for Heart Health 🫀 #doctor #medstudent #surgeon #hearthealth #fypツ,My Newsletter: https://www.drjeremylondon.com/ Instagram: https://www.instagram.com/drjeremylondon/ TikTok: ...,22,health
_x1HZRWQrtk,Who wants some free blood? #medical #health,,27,health
qhdi3pQZQt8,Doctor Drops SCARY HEALTH Bomb on Trump,Shop Adam's new merch collection ➡️ https://shop.adammockler.com/ Click below for premium Adam Mockler content ...,25,health
M-yU4AldxV0,Do This Daily…Your Brain Will Thank You!  #drmandell #health #brain #exercise,,22,health
CMBQ77HzEJg,MRI ##mri #health #wellness #doctor #medicine #nurse #medicina #hospital #medical #healthcare#brain,,22,health
QsChG6k7AGc,English Podcast for Beginners | Let’s Talk About Health in English | Easy English Conversation,Welcome to Mr. English Channel 🎙️ — where learning English is easy and fun! In this episode of our English Podcast for ...,27,health
IQCgcEENStM,Why does eating too much lead to esophageal cancer?#animation #funny #shorts,,1,health
g8flZHOopGs,Healthy Nuskhey 🙏 #chakras #meditationmusic#432hz #health #healthtips #omletarcade#quotes #gyan #new,,27,health
-e-4Kx5px_I,The Best Diet for Brain Health &amp; Memory,"Please watch: ""The BEST Fat Loss Supplement in 2025"" https://www.youtube.com/watch?v=z8k-9P41A5U --~-- In this video, Dr.",22,health
oakWgLqCwUc,Milk. White Poison or Healthy Drink?,Head over to our shop to get exclusive kurzgesagt merch and sciency products designed with love. Getting something from the ...,27,health
q1SjTTBbIWQ,10 Past Product Reviews: Where Are They Now? | Update 59,Today I'm revisiting 10 past product reviews from May-June 2024 to see what happened to them after my review was over.,26,reviews
lhN0zBDb70Y,Baahubali The Epic Movie Review | Yogi Bolta Hai,Baahubali The Epic Movie Review by Yogi Bolta Hai Baahubali The Epic Movie Review Baahubali The Epic Movie Trailer ...,24,reviews
GctkkgDip4g,Dies Irae Review - Pranav Mohanlal - Tamil Talkies,,24,reviews
t207EYIshZs,KING Title Reveal Review | Yogi Bolta Hai,KING Title Reveal Review by Yogi Bolta Hai King Title Reveal Video Review King Title Reveal King Announcement Video Review ...,24,reviews
