video_id,title,description,category_id,keyword
fTKqtvXjkvo,Top Hits 2025 ~ Summer Playlist 2025 ~ Top Songs 2025 Trending Music 🎶🎧,"Welcome to your ultimate summer soundtrack. This summer playlist is packed with the top hits 2025, blending the biggest ...",10,music
SlOSwow6cn8,Rob Deniel – Nandito Ako (Cover with Lyrics | Lyric Video) - Best Tagalog Love Songs 2025 - New OPM,Rob Deniel – Nandito Ako (Cover with Lyrics | Lyric Video) - Best Tagalog Love Songs 2025 - New OPM Welcome to Midnight ...,22,music
4Ubn51w6Ino,SWEETNOTES Nonstop 2025✨Romantic OPM Top Hits 2025 With Lyrics💃New OPM Top Hits Playlist 2025,Sweetnotes Nonstop Playlist 2025✨The Best Of OPM Hit Love Songs 2025  SWEETNOTES Cover Songs 2025 ...,22,music
3lZYvVRCWO0,𝗽𝗹𝗮𝘆𝗹𝗶𝘀𝘁🎧 틀어놓기만 해도 분위기를 채워주는 잔잔한 플레이리스트 | Chill &amp; Mood,"작업할 때, 공부할 때 , 뒹굴거릴 때, 일단 틀어놓으면 분위기는 책임질게요 조용한데 심심하진 않은, 잔잔한데 꽤 감성 터지는 음악 ...",10,music
JWLWczFtCag,BLOK3 - GİT (Official Music Video),"BLOK3 'ün Virtüöz EP 'sinden "" GİT '' isimli parçası video klibi ile birlikte Mundo Music etiketiyle şimdi tüm dijital platformlarda ...",10,music
jpZC476jE7c,"Jahman X-press - ARVA feat. Souleymane Faye, Soda Mama &amp; Kine Lam (clip officiel)",Crédits de la chanson et du clip : Auteur : Jahman X-press Production : OPTIQUE STUDIOS Directed by : IBRAHIMA MBENGUE ...,10,music
7CGKeID7nRc,GIMS &amp; La Mano 1.9 - PARISIENNE (Clip officiel),GIMS & La Mano 1.9 - PARISIENNE (Clip officiel) PARISIENNE disponible en streaming : https://bfan.link/parisienne-1 Abonne-toi ...,10,music
QRHhWwdX59k,DYSTINCT - YAMA (Official Music Video),Subscribe to our channel! Listen to 'DYSTINCT - YAMA' in the link below https://dystinctofficial.lnk.to/YAMA ☆ DYSTINCT ...,10,music
756YdTT-WJ0,"Goon Flavour, Master KG &amp; Eemoh - Ngishutheni (Official Music Video)","Out now: http://africori.to/ngishutheni Subscribe: @wanitwamos Get ready for the ultimate summer anthem! ""Ngishutheni"" is the ...",10,music
AYWSmmwdN2A,Saksi Ang Langit - December Avenue | Best New Tagalog Love Songs 2025 - Hot Hits OPM Trending,"Welcome to Midnight Tears – your ultimate destination for the most beautiful, emotional, and trending OPM Tagalog love songs of ...",22,music
GMkW_mJGvVs,Mga Lumang Tugtugin 60s 70s 80s 90s 🎈Pure Tagalog Pinoy Old Love Songs 🎈 Pamatay Tagalog Love Song,Mga Lumang Tugtugin 60s 70s 80s 90s Pure Tagalog Pinoy Old Love Songs Pamatay Tagalog Love Song ▻Thanks for ...,22,music
IRMmpzCsyWA,Edwin McCain - I&#39;ll Be (Lyrics),Follow the official 7clouds playlist on Spotify : http://spoti.fi/2SJsUcZ ​   Edwin McCain - I'll Be (Lyrics) ⏬ Download / Stream: ...,22,music
ACs908WpUaE,"Alipin - Michael Pangilinan | Top OPM Hits Philippines 2025 - Best Tagalog Songs on Spotify, YouTube",Alipin - Michael Pangilinan | Top OPM Hits Philippines 2025 - Best Tagalog Songs on Spotify & YouTube ✨ Let your heart dive ...,22,music
8of5w7RgcTc,Afusic - Pal Pal (Official Music Video) Prod. @AliSoomroMusic,Listen Now On Spotify - https://open.spotify.com/track/4LMlVCXHJtCE9abhmn0mYo?si=ec8a6d106a054b63 If you've ever ...,10,music
6wmDlk-7aMk,YLL LIMANI - LARG (Official Music Video),YLL LIMANI - LARG (Official Music Video) Subscribe to my YouTube channel here: https://lnk.to/subscribeYllLimani Turn on the ...,10,music
CIvjOVFCOig,"PAMPATULOG | ROMANTIC LOVE SONGS | COMPILATION | NON STOP MUSIC | LOVE SONGS 70s, 80s &amp; 90s","Experience the ultimate Pampatulog playlist with a beautiful compilation of romantic love songs from the 70s, 80s, and 90s.",22,music
RGW5nMfZpp4,Ethiopian Music : Eyu Tsega እዩ ፀጋ (ከማን ጋር ላወዳድርሽ) - New Ethiopian Music 2025(Official Video),Ethiopian Music : Eyu Tsega እዩ ፀጋ (ከማን ጋር ላወዳድርሽ) - New Ethiopian Music 2025(Official Video) Ethiopian Music: ...,24,music
M6W-yuxF7Vc,【放鬆治愈歌單】美國鄉村音樂 x 溫暖女聲，陪你一個人安靜的獨處，聽見自己的心聲｜治愈歌單｜放鬆歌單｜#studymusic #folksong,Hi，我們又遇見了。本次影片創作了22首美國鄉村音樂風格音樂，依舊是溫柔的女聲，簡約的旋律，希望能觸動你的心。就讓這個 ...,10,music
F0d8JJUNkqo,"Tabola Bale - Silet Open Up (feat. Jacson Zeran, Juan Reza &amp; Diva Aurel) (Official Music Video)","Tabola Bale - Silet Open Up (feat. Jacson Zeran, Juan Reza & Diva Aurel) (Official Music Video) Audio Video Credits Artists: Silet ...",10,music
MHy-8I4RQd0,Slow Rock Love Songs Collection 70s 80s 90s | Nonstop Slow Rock Pinoy Medley 💕 Best Luamang Tugtugin,"Slow Rock Love Songs Collection 70s 80s 90s, Nonstop Slow Rock Pinoy Medley, Best Lumang Tugtugin – Relive the golden ...",10,music
VTbo8E8es9A,Mbosso - Pawa (Official Music Video),"Music video by Mbosso performing, “Pawa” (Power), is a heartfelt, poetic love song by Mbosso that captures the overwhelming ...",10,music
1SQLXUH4JSc,"မင်းနဲ့  - Nay Min Eain, Jewel (Official Music Video)","Vocal - Nay Min Eain, Jewel Composer - Nyein Chan Co Harmony - Acapella (Ludee, Sithu) Music Producer- Dave Chen Mixing ...",10,music
uRiB1tsFIkE,KATSEYE - Gabriela (Lyrics),Follow the official 7clouds playlist on Spotify : http://spoti.fi/2SJsUcZ ​   KATSEYE - Gabriela (Lyrics) ⏬ Download / Stream: ...,10,music
Ov0WLxomDs4,Naane Neenanthe Lyrical Video | BRAT | Sid Sriram |Lahari Mahesh|Darling Krishna|Manisha|AJ|Shashank,"The trio of Chartbuster JAGAVE NEENU GELATHIYE, Shashank X Sid Sriram X Arjun Janya are back with Another Soulful ...",24,music
qMMg5z2RWn8,Xojiakbar Ruzmetov - Sev mani \ Хожиакбар Рузметов - Сев мани (Videoklip),Xojiakbar Ruzmetov - Sev Mani Video Director: Sherzod Umarov Producer: Akhmedov Bekhruz ✍️ Author: Alem Choriyev ...,10,music
_JWMjsb1spw,"Best Silent Sanctuary Playlist 2025: 14, Ikaw Lamang, Kundiman | Trending Songs Philippines",Welcome to Midnight Tears – your ultimate destination for the most emotional OPM songs that touch the soul. This special ...,22,music
rHZWxxtCptc,Tiktok Mashup November 💜2025💜 (Not Clean),"Donate : https://paypal.me/levandao91 tiktok mashup, mashup not clean, tiktok mashup 2024, tiktok mashup 2024not clean, tiktok ...",22,music
_amq3hxHIIc,Sanwariya Kar Do Beda Paar | Soulful Devotional Song | Bhakti Vibes🧘✨🕉️ #ai #song,Sanwariya Kar Do Beda Paar | Soulful Devotional Song | Bhakti Vibes  ✨🕉️ #ai #song This video is created using Artificial ...,22,music
cFjTcxZTZJg,Sunnatillo Do&#39;stov - Alyonushka | Суннатилло Дустов - Алёнушка,Shoir: Sunnatillo Do'stov Bastakor: Sunnatillo Do'stov RizaNova ilovasini yuklab oling @ https://rizanova.uz/apps Obuna bo'ling ...,10,music
W4d_I1vgw3s,Jerron Gutana Cover 2025 🎶 Air Supply Medley x MLTR Medley Tagalog Version 🎶 Original Filipino Music,Jerron Gutana Cover 2025 Air Supply Medley x MLTR Medley Tagalog Version Original Filipino Music ...,22,music
8zIJuhNxWZE,Rob Deniel - NANDITO AKO (Cover with Lyrics),ROB DENIEL - NANDITO AKO (Cover Lyrics | Lyrics Video) This lyrics video features a full cover performance of the OPM hit ...,22,music
qeHOXg9Qnp8,Top 8 K-Pop Demon Hunters Songs (CD MUSIC),kpopdemonhunters #kpop #bass #viral #music #tiktok 00:00 - Golden by HUNTR/X 03:10 - Your Idol by Saja Boys 06:14 - Soda ...,10,music
AK-OfzFRO_A,Athuru Mithuru ( අතුරු මිතුරු ) - Dinudi Hettiarachchi | Official Music Video,Athuru Mithuru Official Music Video by Dinudi Hettiarachchi ♪ Stream & Download: https://eylnd.vyd.co/AthuruMithuru Powered ...,10,music
fN_Vq5FMTWs,&quot;He&#39;s probably out cheating&quot; 😭💔,"Credit: whyk4re , Young Dylan , Law&Crime Network , YNW Melly We respect copyright laws and comply with takedown ...",10,music
nWjpA4Nbpe8,Top OPM Songs Philippines 2025 🎧 Saranggola - Ben &amp; Ben | Best Tagalog Hits on Spotify &amp; YouTube,Top OPM Songs Philippines 2025 Saranggola - Ben & Ben | Best Tagalog Hits on Spotify & YouTube Fly high with the ...,22,music
9QBwrzff06g,Draganov - TACH (Official Music Video),Subscribe to Draganov's YouTube channel here: https://www.youtube.com/@MrDraganov ♪ Listen to TACH on the digital ...,10,music
qSUTwjjCK-E,BAYANSULU - Aua rai | Official Video,BAYANSULU - Aua rai Composer: Kuat Abil Lyricist: Rakymzhan Ramazan BAYANSULU social: Instagram: ...,22,music
rV4iG4nn5Iw,Nati Ker - Neger Neger | ነገር ነገር - New Ethiopian Music 2025 (Official Video),Nati Ker - Neger Neger | ነገር ነገር - New Ethiopian Music 2025 (Official Video) Subscribe to Nati Ker | And Turn ON ...,24,music
EIUOC3DZdxE,Top Hits 2025 - Music 2025 || New Songs  Best English Songs  Best Pop Music Playlist  on Spotify,topsongs #topmusic #pophits #popsongs Top Hits 2025 - Music 2025 || New Songs Best English Songs Best Pop Music Playlist ...,10,music
2FFEo2RN0yU,Khadeair - Magumba [Visualizer] (Performance Video),Shot & Directed by Tshegofatso Mahlong Lighting: T.M Photographer Production: Top Level Films.,27,music
BsYrQ1WUCCk,SWEETNOTES Nonstop Love Songs Medley 2025💥Top Hits Tagalog Love Songs💖Love Songs 2025,SWEETNOTES Nonstop Love Songs Medley 2025  Top Hits Tagalog Love Songs  Love Songs 2025 ...,22,music
TN2bJY9qvKo,Keep On Loving You- Harmonica Band ft. Justine &amp; Monica  - Tagalog Songs Cover Of All Time 2025,Fall in love with the heartfelt sound of Harmonica Band ft. Justine & Monica in their beautiful rendition of “Keep On Loving You.,10,music
ogWztLP-_10,🎧 // MONTAGEM COMA [ SLOWED ] (BRAZILIAN PHONK 🥶🥵💀,phonk #phonkmusic #phonkdrift #bass #avee_player Songs for your day  #phonk #funk #music #bassboosted #foryou,10,music
ThkrLRy_KyY,RELAXING REGGAE MUSIC MIX 2025 🎸 NEW REGGAE LOVE SONGS  2025 🔔 ALL TIME FAVORITE REGGAE SONGS 2025,"____  Thanks for Watching  ____ ◢ Share this mix on social media (Facebook, Reddit, Twitter, etc.) so more people can listen ...",22,music
G_bVCZ4fAiw,"Bagong Acoustic OPM 2025💞 💞💞AILA SANTOS, Sarah Geronimo, Angeline Quinto, Klarisse, Morissette Amon","Bagong Acoustic OPM 2025   AILA SANTOS, Sarah Geronimo, Angeline Quinto, Klarisse, Morissette Amon ...",22,music
3ihtcnPwkqI,Acoustic songs 2025 🌸 Music 2025 new songs with lyrics that last through love,"Playlist Spotify: https://magicmusic.lnk.to/theBestPop Welcome to Acoustic Radio, your daily radio for acoustic songs 2025, ...",10,music
R-GxUTK2ezI,August OPM Hits 2025 🎶 Top Tagalog Love &amp; Hugot Songs Playlist | Viral Spotify &amp; YouTube Trends,August OPM Hits 2025 Top Tagalog Love & Hugot Songs Playlist | Viral Spotify & YouTube Trends August OPM Hits 2025 ...,22,music
JgDNFQ2RaLQ,Ed Sheeran - Sapphire (Official Music Video),Listen to 'Sapphire' now: https://es.lnk.to/sapphireID Brand new album 'Play' out now: https://es.lnk.to/play Sapphire - Behind the ...,10,music
SDd3AyocuxU,100%heartattack#heartattack #cover #singer #music #song,,22,music
Rh4xG71oqhU,montagem coma - andromeda | lyrics | aesthetic | whatsapp Status | English songs | slowed | phonk 💀💥,"montagem coma - andromeda | lyrics | aesthetic | whatsapp Status | slowed | speed up | audio #montagemcoma lyrics , aesthetic, ...",22,music
XGsW4mHDRKU,Nine people with life-threatening injuries after stabbings on UK train | BBC News,Ten people are in hospital with nine believed to have life-threatening injuries - after a stabbing attack on board a ...,25,news
C1fnk9H9v5A,LIVE: Police say no suggestion stabbing attack on UK train was terror related | BBC News,"Police say ""there is nothing to suggest"" that a stabbing attack on board a Doncaster-London train is ""a terrorist incident"".",25,news
P4b7aS7oECk,"Update on Bagyong #TinoPH as of 11 AM (Nov. 2, 2025) | GMA Integrated News","State weather bureau PAGASA gives an update on Bagyong #TinoPH as of 11 AM today, November 2, 2025.",25,news
oXmuua6MRMU,"24 Oras Weekend (Part 1) November 2, 2025","24 Oras Weekend is GMA Network's flagship newscast, anchored by Ivan Mayrina and Pia Arcangel. It airs on GMA-7, Saturdays ...",25,news
D02FDmmCupE,সময় সংবাদ | বিকাল ৫টা | ০২ নভেম্বর ২০২৫ | Somoy TV Bulletin  5pm | Latest Bangladeshi News,ncp #shaplakol #tribunal #bnp #julysonod #somoytvbulletin সময় সংবাদ | বিকাল ৫টা | ০২ নভেম্বর ...,25,news
EY0X-0UrQuM,News🔴today nepali news aaj ka mukhya samachar taja l,"News  today nepali news aaj ka mukhya samachar taja l news,today news, today nepali news,aaj ka mukhya samachar,nepali ...",25,news
yJ5EoywaUh4,🔴দুপুরের বাংলাভিশন সংবাদ | BanglaVision Live News Bulletin | 02 November 2025,দুপুরের বাংলাভিশন সংবাদ | BanglaVision Live News Bulletin | 02 November 2025 Banglavision is the most ...,25,news
FctMsp4nCx8,Mass stabbing on UK train leaves nine injured | 9 News Australia,Two people have been arrested after a mass stabbing on a London-bound train in the UK. | *Subscribe and ...,25,news
9_URqL2fl8A,🔴11/02【LIVE】TVBS NEWS晚間整點新聞 重點直播 Taiwan News 20251102,請訂閱【TVBS新聞網】YT  https://tvbs.pse.is/7hnrvn ○TVBS新聞APP 快來下載  https://bit.ly/47n6SOm ○加入【TVBS娛樂 ...,25,news
wTccfmYdySk,"PBS News Weekend full episode, Nov. 1, 2025","Saturday on PBS News Weekend, as the government shutdown begins a new month, tens of millions of low-income Americans ...",25,news
S_FVBbbVO7s,"24 Oras Weekend: (Part 1) November 1, 2025","24 Oras Weekend is GMA Network's flagship newscast, anchored by Ivan Mayrina and Pia Arcangel. It airs on GMA-7, Saturdays ...",25,news
L3aHDNJ4mw8,Sad Incident | Headlines Geo News 5 AM | 2nd Nov 2025,GeoNews ##KarachiFire #BreakingNews #GulistaneJohar #KarachiNews #FireIncident #PakistanNews #RescueOperation ...,25,news
IOZ0frx8HVc,today news🔴 live news || nepali news || live mukhe samachar || today November 2_2025,today news   live news || nepali news || live mukhe samachar || today November 2_2025 #todaynews #live_news #nepalinews ...,25,news
1Xi1QM9Ba9A,Billions in cuts: What Carney&#39;s budget means for Canada&#39;s public services,The public service is bracing for billions of dollars in spending cuts in Tuesday's federal budget. The prime minister has repeatedly ...,25,news
pLhsdZRZ1YU,𝐋𝐚𝐡𝐨𝐫𝐞 𝐑𝐞𝐜𝐨𝐫𝐝𝐬 𝐖𝐨𝐫𝐬𝐭 𝐀𝐢𝐫 𝐐𝐮𝐚𝐥𝐢𝐭𝐲 𝐢𝐧 𝐭𝐡𝐞 𝐖𝐨𝐫𝐥𝐝 | Geo News 12PM Headlines | 02 November 2025,Peshawar #CTD #Blast #Netherlands #TrainCrash #DutchNews #IstanbulTalks #Pakistan #Afghanistan #Taliban #DonaldTrump ...,25,news
CL3dTECP8d8,"Blue Jays lose World Series after historic run | CTV National News for Saturday, Nov. 1, 2025",Subscribe to CTV News to watch more videos: https://www.youtube.com/ctvnews Connect with CTV News: For live updates and ...,25,news
eahwmNfTgzw,এটিএন বাংলার দুপুর ১২ টার সংবাদ | 02.11.2025 | Todays News | Ajker News | ATN Bangla News,atn #atnbangla #atnbanglanews #updatenews #topnews #todaynews #latestnews #breakingnews #news #khobor #sangbad ...,25,news
9K_F4i5rhwg,today news🔴 live news || nepali news || mukhe samachar || mukhe khabar || November 2_2025,today news   live news || nepali news || mukhe samachar || mukhe khabar || November 2_2025 #todaynews #live_news ...,25,news
RMqAFbDjWKg,"বাংলাদেশে আসছেন জাকির নায়েক, সতর্ক বার্তা ভারতের | Zakir Nayek | India | ATN News","বাংলাদেশে আসছেন জাকির নায়েক, সতর্ক বার্তা ভারতের | Zakir Nayek | India ...",25,news
fkjiW9gdz-k,අද දෙරණ 12.00 මධ්‍යාහ්න පුවත් විකාශය - 2025.11.02 | Ada Derana Midday Prime  News Bulletin,Ada Derana | ශ්‍රී ලංකාවේ විශ්වසනීය හා ප්‍රමුඛතම පුවත් සපයන්නා Disclaimer: This ...,25,news
z4Kpx7oM3eg,সময় সংবাদ | বিকাল ৩টা | ০২ নভেম্বর ২০২৫ | Somoy TV Bulletin  3pm | Latest Bangladeshi News,politicalparty #tribunal #teachersprotest #bishwaijtema #somoytvbulletin সময় সংবাদ | বিকাল ৩টা | ০২ ...,25,news
Pjgv0woxERs,【LIVE】昼のニュース（Japan News Digest Live）最新情報など｜TBS NEWS DIG（11月2日）,TBS/JNNニュースから、最新情報をダイジェストでお届けします。 #最新ニュース #TBS #news ▽TBS NEWS DIG 公式サイト ...,25,news
iCzKI_lMv3A,𝐏𝐚𝐤-𝐀𝐟𝐠𝐡𝐚𝐧 𝐓𝐞𝐧𝐬𝐢𝐨𝐧 - 𝐊𝐡𝐚𝐰𝐚𝐣𝐚 𝐀𝐬𝐢𝐟&#39;𝐬 𝐒𝐭𝐚𝐭𝐞𝐦𝐞𝐧𝐭 | Headlines Geo News 9 PM | 1st November 2025,GeoNews #PakAfghanTalks #PakAfghanRelations #PMShehbazSharif #MBS #SohailAfridi #PMLN #DGISPR #PakArmy ...,25,news
SfFHKt8mAS8,Trump Threatens US Military Action in Nigeria | 09 AM News Headlines | 02 Nov 2025 | SAMAA TV,samaatv #pakafghanclash #pakafghanwar #pakindiawar #trump #pakafghanborder #headlines #india #pakistan #israel ...,25,news
ETgyxuZvKjM,Gir Somnath Lion On Volleyball Ground News | ગીરની સિંહણે વોલીબોલ ગ્રાઉન્ડ પર મારી લટાર | N18S,Gir Somnath Lion On Volleyball Ground News | ગીરની સિંહણે વોલીબોલ ગ્રાઉન્ડ પર મારી ...,25,news
ALNqwbdKPOA,AO VIVO: Acompanhe as principais notícias do dia na Record News,Inscreva-se no canal da Record News no YouTube: http://www.youtube.com/recordnews ACOMPANHE A RECORD NEWS ...,25,news
LkNbVsIUuMs,🔴 LIVE  - News 1st: Prime Time Sinhala News - 7 PM (02.11.2025) රාත්‍රී 7.00 ප්‍රධාන ප්‍රවෘත්ති,news1st #primetimenewsnews LIVE - News 1st: Prime Time Sinhala News - 7 PM (02.11.2025) රාත්‍රී 7.00 ...,25,news
SI58SgisjDk,【LIVE】朝のニュース（Japan News Digest Live）最新情報など｜TBS NEWS DIG（11月2日）,11月2日（日）の早朝から TBS NEWS で放送された最新のニュースをダイジェストでお届けします。 ・高市総理「解散を考えて ...,25,news
HahYX-TWVrs,Aaj Ki Taaza Khabar LIVE: Bihar Election 2025 | Dularchand | Mokama Murder | Anant Singh | PM Modi,Aaj Ki Taaza Khabar LIVE: Bihar Election 2025 | Dularchand | Mokama Murder | Anant Singh | Andhra Temple Stampede | PM ...,25,news
xX5ipmMs1gc,DVB Digital မနက် ၁၁ နာရီ သတင်း (၂ ရက် နိုဝင်ဘာလ ၂၀၂၅),ထိုင်းမှာ စစ်တပ်ထောက်ခံတဲ့ အနုပညာရှင်ပွဲအချို့ ဖျက်သိမ်း ...,25,news
_Fjcou9w1ko,Редакция News: 193-я неделя,"Новая Редакция News! 18+ НАСТОЯЩИЙ МАТЕРИАЛ (ИНФОРМАЦИЯ) ПРОИЗВЕДЕН, РАСПРОСТРАНЕН И (ИЛИ) ...",22,news
C-tdbHoSopU,අද දෙරණ 6.55 ප්‍රධාන පුවත් විකාශය - 2025.11.01 | Ada Derana Prime Time News Bulletin,Disclaimer: This video contains visuals taken from external sources solely for news purposes Ada Derana | ශ්‍රී ලංකාවේ ...,25,news
H8fZXdvde2I,এটিএন বাংলার সকাল ৭ টার সংবাদ | 02.11.2025 | Bangla News | Ajker News | ATN Bangla News,atn #atnbangla #atnbanglanews #updatenews #topnews #todaynews #latestnews #breakingnews #news #khobor #sangbad ...,25,news
uzkM-C5TCcs,Breaking News Today LIVE | রাত ৮-টার বড় খবর | Mamata Banerjee | Suvendu Adhikari | SIR News,Breaking News Today LIVE | রাত ৮-টার বড় খবর | Mamata Banerjee | Suvendu Adhikari | SIR News Suvendu Adhikari ...,25,news
kZIjqRmAhgY,F*cksNews: Especial De Halloween II,Boletas Mexico: https://fucks-news-noticreo.boletia.com/ Boletas Panama: ...,23,news
E7NJ6DL7eME,Breaking News Today LIVE | সকাল ১১-টার বড় খবর | West Bengal SIR News | Mamata Banerjee | Abhishek,Breaking News Today LIVE | সকাল ১১-টার বড় খবর | West Bengal SIR News | Mamata Banerjee | Abhishek West ...,25,news
l2WX4YJIzAA,News Ki Pathshala |Sushant Sinha: China ने ऐसा क्या कि Trump झुक गए ?|#shortvideo|#shorts,News Ki Pathshala |Sushant Sinha: China ने ऐसा क्या कि Trump झुक गए ?|#shortvideo|#shorts #newskipathshala ...,25,news
OrayK8iWBDA,24 Dead from Hurricane Melissa | Widespread Looting Reported in Black River,"Jamaica News Today - Television Jamaica (TVJ) a Trusted Source for News, Sports & Entertainment. For Jamaican news, sports ...",25,news
jLBSM5nJ01c,#LIVE | এই মুহূর্তের বড় ব্রেকিং | Republic Bangla LIVE | Breaking News | West Bengal News,LIVE | এই মুহূর্তের বড় ব্রেকিং | Republic Bangla LIVE | Breaking News | West Bengal News ...,25,news
mw7CNzXbFL4,"Today Breaking News ! आज 02 नवंबर 2025 के मुख्य समाचार बड़ी खबरें, PM Modi, UP, Bihar, Delhi, SBI","Today Breaking News ! आज 02 नवंबर 2025 के मुख्य समाचार बड़ी खबरें, PM Modi, UP, Bihar, Delhi, ...",25,news
343L2DfmrQY,🔴11/01【LIVE】TVBS NEWS晚間整點新聞 重點直播 Taiwan News 20251101,請訂閱【TVBS新聞網】YT  https://tvbs.pse.is/7hnrvn ○TVBS新聞APP 快來下載  https://bit.ly/47n6SOm ○加入【TVBS娛樂 ...,25,news
CnxnerjLp30,Taiwan&#39;s Military Welcomes M1A2T Abrams Tanks Into Service｜TaiwanPlus News,"Taiwan's new M1A2T tanks enter service, but with cheap drones now capable of taking out costly armor, how can Taiwan make ...",25,news
K3p6Zx5biD8,Bihar Election 2025 LIVE News | NDA | Mahagathbandhan | Manifesto | Mokama Murder | Dularchand Yadav,Bihar Election 2025 LIVE News | NDA | Mahagathbandhan | Manifesto | Mokama Murder | Dularchand Yadav Dularchand Yadav ...,25,news
UFYjWVq6LcE,&#39;I felt helpless&#39; | Cambridgeshire train stabbings eye witness recalls horrific incident,'I stood there praying. I felt helpless. This is not the England I grew up in.' GB News' Mark White reads out a statement written by ...,25,news
gvW4M5wRz9Y,রাতের বাংলাদেশ | Latest News | Rater Bangladesh | 10 PM | 01 November 2025 | Jamuna TV,ফেব্রুয়ারিতেই হতে হবে জাতীয় নির্বাচন। আর নির্বাচনের দিনই করতে ...,25,news
YWL0cq0Rp58,Aaj Ki Taaza Khabar Live : 02 November 2025 | PM Modi | Bihar Election | NDA | RJD | Hindi News Live,Aaj Ki Taaza Khabar Live : 02 November 2025 | PM Modi | Bihar Election | NDA | RJD | Hindi News Live #live #livenews ...,25,news
osigTG6B2KA,এটিএন বাংলার বিকাল ৪ টার সংবাদ | 01.11.2025 | Today&#39;s News | Latest News | ATN Bangla News,atn #atnbangla #atnbanglanews #updatenews #topnews #todaynews #latestnews #breakingnews #news #khobor #sangbad ...,25,news
WoDF6Ls5mA8,Cambodia starts removal of heavy weapons and equipment from border,"DD India is India's 24x7 international news channel from the stable of the country's Public Service Broadcaster, Prasar Bharati.",25,news
6QgOdpKNeP4,এটিএন বাংলার সন্ধ্যা ৬ টার সংবাদ | 01.11.2025 | Bangla News | Ajker News | BD News | ATN Bangla News,atn #atnbangla #atnbanglanews #updatenews #topnews #todaynews #latestnews #breakingnews #news #khobor #sangbad ...,25,news
denRCsbb9fE,"Hafiz Saeed Big Beaking News LIVE : मारा गया भारत का सबसे बड़ा दुश्मन, हाफिज पर बड़ी खबर!| Modi",क्‍या भारत के नंबर वन दुश्मन हाफिज सईद का काम तमाम हो गया है?,25,news
YHqpKFaFbyc,Tomahawk Steak Frites!🥩 @ChefRush,,26,cooking
CFArDEL2_RQ,How to Cook Rice in a Coconut #bushcraft #cooking #camping,"How to Cook Rice in a Coconut Welcome to ""Mao Bushcraft"" - where creativity and survival skills merge in an exciting YouTube ...",19,cooking
hziqTqnleM0,I Cooked Every Bird in the World,Check out MaxJerky here! https://www.maxjerky.com/pages/all-products ————— SUBSCRIBE and RING THE BELL to get ...,22,cooking
IHDX1eVP-_Q,Fried chicken sandwich with meat ball 😋,,24,cooking
RGDYst6eErY,This can’t be real #recipe #cooking #foodasmr #food,,22,cooking
dv7BDkQmvhA,How to Cook with Ice 🧊,"Leave a like, subscribe & hit the notification button! Business Inquiries: jetbentlee@gmail.com.",22,cooking
VrydNMFT8f4,would you eat this? #asmr #cooking,Best of Zach Choi Foods | MUKBANG | COOKING | ASMR Check out my TikTok: http://www.tiktok.com/@thezachchoi Check out ...,22,cooking
Ef16KZFk1jA,Chicken Parm Sandwich! @itsQCP,,26,cooking
9FLFC19T2p4,No B.S cooking episode 1,,26,cooking
JBJBLztz_CM,Eat the Balls dammit! @GugaFoods @patrickzeinali #cooking #chef #funny #cooking #viralvideo #yum,,24,cooking
KfkrYaSZv9w,How to crispy cake recipe #shorts #shortvideo #cooking #food #recipe,,22,cooking
6Db60rwdOuY,How To Cook Blue Lobster,lobster #joke #shorts.,22,cooking
tCNiIbnJ9BI,Fishing🔥 #fishing #cooking #survival #carpfishing #food,,22,cooking
DBmq18buMIo,My Kids Wanted Cheeseburgers #shorts #cooking #recipe,,22,cooking
