video_id,title,description,category_id,keyword
eFoKUyq8dtM,Easy sweets milk balls #viralvideo #foodshorts #sweets #dessert #foodshorts #shorts,sweet #mishti #dessert Easy sweets milk balls #viralvideo #foodshorts #sweets #dessert #foodshorts #shorts.,26,food recipes
yIu318Vcg3E,আটার বিস্কুট 🍪 #shorts #trending #food #recipe #homemade #viralvideo,Almond pistachio cookies recipe #shorts #trending #traditional #food #recipe #cooking #homemade #viralvideo.,22,food recipes
bAu4-iclG5U,Soft Potato Taco Bowl | Quick and Easy Recipe #onestopchop,Soft Potato Taco Bowl is my new favorite. Used to make these all the time when I worked at Taco Bell! Perfect for meal preps too ...,22,food recipes
OAZpSsu03VA,Pasta | Pasta recipe | How to make pasta 🍝🍝😋,pasta | Pasta recipe | How to make pasta #recipe #pasta #homemade homemade pasta recipe pasta recipe at home enjoy the ...,22,food recipes
vr4p_Vp6cxw,Crispy Bread Roll ASMR Cooking #shorts #food #cooking #asmrcooking #crunchytreats #streetfood,Crispy Bread Roll ASMR Cooking #shorts #food #cooking #asmrcooking #crunchytreats #streetfood.,22,food recipes
uWoB0_3wSrY,Sheet Pan Chicken Kefta 🔥 (Full recipe pinned in the comment section),,22,food recipes
M9EPL4V2i-0,Day 61🍴Instant Food Recipes!😍🔥Cheeseburst Bread Pizza🍕Must try👌 #pizza #breadpizza #quickrecipe,,22,food recipes
aOLyq27WbLA,3 EASY Japanese Dishes to Make at Home,All of the recipes and more are available on my blog (link in bio) KyrieTheFoodie.com Make sure to subscribe to me ...,22,food recipes
v2oHa5oxM00,New Chocolate dessert recipe by food ward fyz,,26,food recipes
k-WKTGyt1Io,Day 40🍴Instant Food Recipes!😍 Tandoori Soyabean Must try👌 #healthyfood #quickrecipe #soyabean,,22,food recipes
lT9Jvbou77g,Never eat this #cooking #recipe #foodasmr #food,,22,food recipes
pFFsWfvODaw,EASY CHINESE EGG CREPE RECIPE #recipe #cooking #chinesefood #crepe #comfortfood #jianbing #egg,,22,food recipes
-4VIMljwF2k,How did I not know about this easy one-pan dinner  #easyrecipe #recipe #dinner #cooking,,26,food recipes
tRLF6H9tHzU,4 Family Dinners for $20 at Dollar Tree | Extreme Budget Meals Pt. 2,4 Family Dinners for $20 at Dollar Tree | Extreme Budget Meals Pt. 2 Back with another round of extreme budget meals to help ...,26,food recipes
Anfzh3d0Fac,🍞💛 Rasmalai Bread Recipe | Instant Indian Dessert 🤯,foodshorts #streetfood #asmr #mukbang.,26,food recipes
SxsyrEn8bn0,Easy pasta stir fry with Turkey,,26,food recipes
px77yCcmNyI,Easy High Protein Salad- Creamy Green Bowl #recipe #fitness #easyrecipe #food #weightloss #viral,,22,food recipes
QDAm_c03w4Q,Put Egg Into Semolina Recipe By ijaz Ansari | Yummy And Tasty Recipe | Egg Recipe | Suji Recipe |,suji #Egg #ijazansarifoodsecrets #ijazansarirecipes #recipe #yummy #tasty #anda #semolina.,26,food recipes
fKZDL6W5np0,Peanut Chocolate Burfi &amp; laddu | Peanut Recipes | शेंगदाणे विशेष| Village Cooking | Red Soil Stories,"Episode 123 Namaste, I am Pooja and Welcome to a Peanut Special ( शेंगदाणे विशेष ) Episode of ...",26,food recipes
pGjm65CmYYI,Bhindi Masala #shorts #bhindimasala #bhindirecipe #bhindicurry #indianfood #indianrecipe #food,Ingredients: 1. Okra – 300g 2. Oil for frying 3. Salt as per your taste 4. Red chili powder- 1tsp 5. Cooking oil – 2tbsp 6. Cumin ...,26,food recipes
RBBm__1DHvE,Spicy Aloo Tuk ASMR Cooking || #shorts #food #asmr #recipe #indianasmrworld #streetfood #snacks,Spicy Aloo Tuk ASMR Cooking || #shorts #food #asmr #recipe #indianasmrworld #streetfood #snacks.,22,food recipes
-CO3LpblrYk,Best easy meal #easymeal #soysauceeggs #easyrecipes #jinyandfood,,22,food recipes
fq0axZS3aOw,Lunchbox ideas! Cold Chicken sandwich | Pakistani chicken sandwich Homemade chicken sandwich recipe,,26,food recipes
-KKfHX56OTY,3 EXERCISES FOR A TONED CORE! #fitness,These are 3 exercises that I LOVE to include in my workouts to help build strength and tone the core. #fitness #homeworkout ...,22,fitness
DCpar5QDo6E,"Cardio, but make it quiet 🤫#shorts #fitness #cardio #cardioworkout #blogilates #pilates #workout",,26,fitness
YEyFdtni3uU,5 MIN ARM WORKOUT,"A super quick and effective 5 minute arm workout using dumbbells/weights! The full, follow along, workout can be found on my ...",22,fitness
-RNMhjDPk4s,Getting results at home. Epic legs &amp; glutes workout. #fitness #workout #legday  #homeworkout #viral,Most people I see are training with exercise selections based on what body part it trains. I want to show you how I program ...,26,fitness
AJUh03WB8F4,Big LEG day workout with dumbbells,shorts #fitness #workout #homegym #legworkout #legday #quads #buildmuscle #burnfat #strengthtraining #flex #tgif ...,17,fitness
LzX5Xf5JN-E,The worst arm workout ever,Subscribe to my main fitness channel: https://www.youtube.com/user/NalewanyjFitness Get Your FREE Workout & Diet Plan: ...,22,fitness
-X3rY91kUX8,Life&#39;s not Fair...😭,shorts #viral #trending #YoutubeVideo #fyp #gym #couple #fitness #gymgirl #funny #gymtok #workout #gymcouple.,22,fitness
enYITYwvPAQ,FAST Walking in 30 minutes | Fitness Videos,30 minutes of fast walking MOST days of the week is super HEALTHY! A very special EDIT from the hit series Miracle Miles!,1,fitness
SMBTOeouZ0I,"ШЕЯ-Блок, Отложения, Застои 🔑  #здоровье #motivation #fitness #training #спорт ","Сонные Артерии, подключичные, позвоночные, брахиоцефальный ствол. Эти артерии обеспечивают кровью мягкие ткани ...",22,fitness
_3bDMW84Kd0,The doctor who prescribes exercise for longevity #shorts,"Dr. Peter Attia says the best drug to delay physical and cognitive decline is exercise, and he takes it in large doses. He aims for ...",25,fitness
3EKcdVsYdk4,25 MIN FULL BODY WORKOUT AT HOME (Fat Burn &amp; No Equipment) 전신 맨몸 운동 홈트 25분 (체중감량 &amp; 장비없음),"Hello, I'm Jaeho, a trainer and physical therapist. Today's routine is a 25-minute, two-intensity, full-body workout designed to help ...",22,fitness
L-FZZJeuTZk,Six pack workout #fitnessmotivation #fatloss,,17,fitness
qB281BY13b8,4 am routine 🤸🏼‍♀️ #fitness #productivity #morningroutine #dayinmylife #morning motivation #gym,,22,fitness
EWhMxVsIfPY,Start now! #workout #fitness,,22,fitness
AdqrTg_hpEQ,Walking Exercise with the SUPER Coaches! | Walk at Home,"Join the Walk at Home family and two of the ""scholars"" in Health & Fitness for some healthy walking exercise! Dr Ian Smith and ...",22,fitness
wYc_tahbqkk,#fitness #workout #weightloss,,17,fitness
h3lTfxszM30,the contrast 🤧  #gym #trending #fit #fitness #workout #training   #gymrat #calisthenics,,22,fitness
4bGXW8vuZvM,Power Walk | 1 Mile Workout | Walk at Home,Try our NEW Power Walk Series here on You Tube! If you like this 1 Mile ... you will LOVE the full series! The Walk at Home APP ...,22,fitness
g6LTM6cVHUc,"Lose Weight Fast , Home Workout","Lose Weight Fast , Home Workout #weightloss #homeworkout #exercise #yoga #fatloss #bellyfatloss #chestworkout #health.",17,fitness
59ZnUHNwI0c,Bruno Mars Walking Workout | Daily Workout at home | 8 minutes,Welcome to Bruno Mars Walking Workout. Daily Workout at home This workout is an absolute party with no commentary. We're ...,17,fitness
bSnNQaAr5l8,Walk Yourself Healthy! - a YouTube Fitness Show | Episode 1 | Walk at Home,Hello Wonderful Walkers! It's me ... Leslie! We hope you'll enjoy this NEW Fitness Show exclusively for You Tube! I am in the ...,22,fitness
BsPkvVM4XoY,Get a slim waist &amp; toned body in 7 days! With bottle #pilates #workout #fitness,,26,fitness
OOBvr3bCBz0,Get a slim Waist in 7days #pilates #workout #fitness,,26,fitness
rJ7wzxs-en4,"Sixpack bodybuilder, YouTube trend #gym #exercise, #health #fitness #motivation #izharshort😭🌍","Sixpack bodybuilder, YouTube trend #gym #exercise, #health #fitness #motivation #izharshort.",24,fitness
y2PhXysg2do,19 to 24 Natural Transformation #gym #viral #youtubeshorts #fitness #youtubeviral #shortsviral,,23,fitness
qsCxdsrV5Fc,1 Mile At Home Walk with Nick | Walking Workout,Walk 1 Mile with Nick! We are at home with Nick! This is a brand new mile with Nick will give you a great walking workout in just 15 ...,26,fitness
X7Nkm-umCBI,40 minutes and one kettlebell for a full body strength workout. #kettlebell #fitness #workout,,22,fitness
OlMN75a-OwI,Full Body Insanity Dumbbell Circuit. Try if you dare 💪🏽 #fitness #hiit #workout,,22,fitness
ZCSGRrzHS7g,35 Mins Exercises For Weight Loss | Best FULL BODY WORKOUT | Zumba Class,"35 Mins Exercises For Weight Loss | Best FULL BODY WORKOUT ღ Like, Share and Subscribe: subscribe ...",26,fitness
hnAOu6PMhnY,How to grow your arms #gym #motivation,,22,fitness
HogEzxuWKcM,🔥 Lose Belly Fat FAST! 🔥 10-Min Home Workout (No Equipment),Lose 1 Inch Overnight! (Doctor-Approved Trick) Slim Thighs in 3 Days? (Shocked Everyone!) No Gym No Problem! Burn Fat While ...,26,fitness
x-ImhnwOVIw,3 changes that helped transform ❤️ #transformation #fatloss #fitness,,22,fitness
hmMO3eGTEvA,Hips fat burning workout #fatloss #fitness #fitnessmotivation #bellyfat,,17,fitness
4zQg9s1BP-4,"one action to lose belly fat, lose weight, 100 per day #fitness #workout",,26,fitness
ZrLtXNWZ2W0,full chest workout in home 🫵 try this 🔥#motivation #workout #gym #desi #fitness #shorts #trending,,22,fitness
SETmZAMVW3g,Testing your fitness levels like Dr. Peter Attia,Dr. Peter Attia says longevity is about living longer and improving your quality of life — and intense exercise is part of the way to ...,25,fitness
eaPBruNUglE,six pack abs exercises #shorts #abs #sixpackabs #shortvideo  #absworkout,six pack abs exercises #shorts #abs #sixpackabs #shortvideo #absworkout #absexercise #gym ---- The Best at-Home Ab Workout ...,17,fitness
cbKkB3POqaY,25 MIN FULL BODY HIIT for Beginners - No Equipment - No Repeat Home Workout,"Find the right workout plan for you in my fitness app – let's grow together! https://quiz.growwithanna.com/ Team, get ready for 25 ...",17,fitness
cZuspnI9nf0,&quot;GET STRONG&quot; Kids Core Workout (How To Get A Strong CORE),"Today we are doing a KIDS CORE WORKOUT! These KIDS EXERCISES will help build a strong core so you can run faster, jump ...",22,fitness
3AeqkqYwJ3A,"Best home workout of forearm, triceps and chest no equipment for beginners|#shorts #youtubeshorts",Best home workout for forearm without equipment for beginner. Build your forearm more strong and attractive at home without ...,22,fitness
u-lX1asAO-g,18 Minute Dance Workout At Home | Exercise To Lose Weight FAST | Zumba Class,18 Minute Dance Workout At Home | Exercise To Lose Weight FAST | Zumba Class #MiraPham #AerobicWorkout #ZumbaClass ...,26,fitness
oJ70ZNOlLJg,#gymmotivation #workout #fitness #athlete #bodybuilding #powerlifting #gymlife #gymgirl #gym,,22,fitness
x5p9d1kO_2I,#weightloss #youtubeshorts #trending #exercise #fatloss #fitness #workout #bellyfat #shorts #views,weightloss #youtubeshorts #trending #exercise #fatloss #fitness #workout #bellyfat #shorts #views @santoshfitnessseries Your ...,17,fitness
R9Fk-N9fMxk,“GET STRONG” Best Core Exercises For Kids (15 Minute Kids Workout),Today Vivien is leading a 15 Minute Kids Workout to get a strong core and body! These are the best core exercises for kids to get ...,22,fitness
ouKGDXF108U,6 Months Cutting Weight Results 🔥 #fitness #gym #viral #finance #motivation #transformation #shorts,Are you also investing in your body & your future? I'm using YouTube Shorts as my (almost) daily diary - tracking my ...,17,fitness
8Cco83VVVLI,Day 26 | RUKNA NHI HAI ❤️🎯 | #fatlosejourney #weightloss #motivation #gym #fitness #viral #trending,,22,fitness
mUJG782RzNs,Every Lifter will relate #bodybuilding #fitness #shorts,,24,fitness
-ye4Dv5AyJE,2020 vs 2024 #shorts#fitness#gym,,22,fitness
xjrDTiNIQOc,upper body workout at home for male&#39;s #fitness #shorts #exercise #workoutathome #beginners #male,Business Quarry: ggym43878@gmail.com.,22,fitness
yebNIHKAC4A,“Golden” Official Lyric Video | KPop Demon Hunters | Sony Animation,"We're going up, up, up. Watch the official lyric video for “Golden” from KPop Demon Hunters. KPop Demon Hunters is now on ...",1,kpop
983bBbJx0Mk,&quot;Soda Pop&quot; Official Lyric Video | KPop Demon Hunters | Sony Animation,Listen to the KPop Demon Hunters soundtrack here: https://kpopdemonhunters.lnk.to/Soundtrack About KPop Demon Hunters: ...,1,kpop
cWppAbqm9I8,&quot;Your Idol&quot; | Official Song Clip | KPop Demon Hunters | Sony Animation,"Keeping you obsessed with ""Your Idol"" from KPop Demon Hunters. Watch the movie on Netflix now. Listen to the KPop Demon ...",1,kpop
Ytmcwjf2amw,Your Idol,Provided to YouTube by Universal Music Group Your Idol · Saja Boys · Andrew Choi · Neckwav · Danny Chung · Kevin Woo ...,10,kpop
CgCVZdcKcqY,BLACKPINK - ‘뛰어(JUMP)’ M/V,BLACKPINK - 뛰어(JUMP) I'm not that easy to tame You should see me under these lights All my tears turn to ice That's the ...,10,kpop
nmt594aKD9U,Soda Pop: Las guerreras K-pop 2025  | Clip oficial | Netflix,Ídolos perfectos? Más bien una cortina perfecta. Los Saja Boys debutan con Soda Pop y conquistan al público al instante.,24,kpop
C5n5YsiFnyM,《Kpop 獵魔女團》｜歌曲合輯｜Netflix,輪播收聽更方便了   #kpop獵魔女團-- 可以開啟cc英文字幕/ 部分歌曲段落無提供中文翻譯-- 她們不只是演唱會一票難求的人氣女團， ...,24,kpop
eHHQaoEW30Q,TWICE &quot;THIS IS FOR&quot; M/V,"TWICE ""THIS IS FOR"" M/V 4⃣Listen [THIS IS FOR]4⃣ https://TWICE.lnk.to/THISISFOR TWICE Official Shop: ...",10,kpop
QGsevnbItdU,&quot;How It&#39;s Done&quot; Official Lyric Video | KPop Demon Hunters | Sony Animation,"HUNTR/X show you how it's done, done, done. Watch the official lyric video for ""How It's Done"" from KPop Demon Hunters.",1,kpop
wlHwjkYpSr0,BABYMONSTER - ‘WE GO UP’ M/V,WE GO UP Yeah This ain't a game and you know we don't play You ain't never seen the typa show we boutta show ya You ain't ...,10,kpop
JaM-fXm3DTA,K-POP DEMON HUNTERS PLAYLIST OST,"Get ready to vibe with the hottest remixes! If you enjoy this video, make sure to LIKE, SUBSCRIBE, and turn on the for more ...",10,kpop
rRTWmsK47pQ,Soda Pop (Saja Girls Version) | KPop Demon Hunters Animation |【Female Cover by MilkyyMelodies】,STREAM THIS SONG NOW ▶︎ https://ffm.to/5ln5eyw If the Saja Boys were a demon girl group called the Saja Girls singing Soda ...,10,kpop
o9V8HrgJgIg,BABYMONSTER - &#39;WE GO UP&#39; EXCLUSIVE PERFORMANCE VIDEO,BABYMONSTER #베이비몬스터 #2ndMINIALBUM #WEGOUP #EXCLUSIVE #PerformanceVideo #YG More about ...,10,kpop
bmc2kKA5dvc,&quot;How It&#39;s Done&quot; Huntrix | Live Action Music Video | KPop Demon Hunters | Song Cover | Sony Animation,howitsdone #huntrix #kpopdemonhunters Available in 8K resolution. Le Gianna is 12 years old. Business Inquiries Only: ...,22,kpop
l8Dr7vzMSVE,"“Takedown” Official Lyric Video feat. Jeongyeon, Jihyo and Chaeyoung from TWICE | KPop Demon Hunters",Are you ready for the takedown? Watch the official lyric video for “Takedown” from KPop Demon Hunters performed by Jeongyeon ...,1,kpop
T7Q7ZhNyHqk,Your Idol: Las guerreras K-pop 2025  | Clip oficial | Netflix,"Después de su victoria en los Idol Awards, la presentación de los Saja Boys toma un giro oscuro. ¡Esto no es solo buena música, ...",24,kpop
wGVowiBQhCQ,Mission: Rescue Hunrtix | K-Pop Demon Hunters,"Disclaimer: This video was created using AI tools for entertainment purposes only. All characters, voices, and animations are ...",24,kpop
mGYz0yxbRN8,"Which cat is the cutest? Rumi, Zoey and Mira??? Kpop Demon Hunters Animation","Welcome to my art corner! I'm a freelance artist who loves bringing anime scenes to life through my own style. In this video, I'm ...",22,kpop
mYlPXDP-i2o,Mira and Zoey&#39;s Jacket changes color! 😱 | Kpop demon hunters #shorts,Mira and Zoey's Jacket changes color! | Kpop demon hunters #shorts #kpopdemonhunters #kpopdemonhuntersnetflix ...,24,kpop
TbMEMCvFbZk,&quot;What It Sounds Like &quot; | Official Song Clip | KPop Demon Hunters | Sony Animation,"Fearless and undefined, this is what it sounds like! Enjoy this official song clip from KPop Demon Hunters. The film is now ...",1,kpop
kD25TfXC-cs,“How It&#39;s Done” Pelea Canción | Las guerreras K-pop,"Ve la película completa en Netflix! © Sony Pictures Animation, Netflix.",24,kpop
Ug_pv5-r1js,“What It Sounds Like” Song Clip | KPop Demon Hunters | Netflix Family,"Rumi, Zoey, and Mira reunite on stage to fight Gwi-Ma and his demon army while singing the song they couldn't write. Sing along ...",24,kpop
co-TFLbaZAE,“Gabriela” Performance Video | KATSEYE,Gabriela” Performance Video Stream “Gabriela”: https://KATSEYE.lnk.to/Gabriela Watch the 'Gabriela' Official Music Video: ...,10,kpop
LspABe_Hxoo,“Golden” Huntrix | Live Action Music Video | KPop Demon Hunters | Song Cover | Sony Animation | IRL,golden #huntrix #kpopdemonhunters Golden - (DJ MYSTIK Festival Mix) Song cover lead vocals by: Rumi - Le Gianna ...,22,kpop
Glk9piFNBWI,[KPop Demon Hunters In Public] “Golden” - HUNTR/X Dance By BABY WARRIORS From Vietnam,Dance Cover | KPop Demon Hunters “Golden” - HUNTR/X Please SUBSCRIBE for more dance videos ❤️ Thank you!,22,kpop
U3ncuCL_1IU,KPOP Demon Hunters is available now! Link in Bio! ❤️,,22,kpop
3-VwlTqxH-0,Who&#39;s Your Favorite? - &quot;KPop Demon Hunters (케이팝 데몬 헌터스)&quot;,"""Golden"" is a song performed by Ejae, Audrey Nuna, and Rei Ami as the fictional K-pop girl group Huntr/x in the 2025 animated ...",10,kpop
Fyq1tvSa9Qc,KPOP Playlist girl group 2025 [DANCE PERFORMANCE] 💽🩷 Vol2,"Hi! Glad to see you here, THANKS for watching and listening this video Please LIKE and SHARE this video ❤️ And don't forget ...",10,kpop
B1ShLiq3EVc,IVE 아이브 ‘XOXZ’ MV,STARSHIP SQUARE (Domestic) : https://bit.ly/3HtQ7GF STARSHIP SQUARE (Global) : https://bit.ly/4i5Dl1g IVE US EXCLUSIVE ...,10,kpop
NIhlJAoP3Tw,HUNTR/X | &quot;Your Idol&quot; | Kpop Demon Hunters (Fan Animation),blender #animation #kpopdemonhunters.,22,kpop
9e9t3VdAHLw,LA PLAYLIST 🇫🇷 ULTIME KPOP DEMON HUNTERS (Karaoké style),Les meilleurs morceaux de KPop Demon Hunters disponibles dans cette playlist 100% française pour le plaisir des fans (et le ...,24,kpop
UT2Z6TuPOsA,RAPAPAPAPA 💖Kpop Demon Hunters - The cute girls of HUNTR/X,"Welcome to my art corner! I'm a freelance artist who loves bringing anime scenes to life through my own style. In this video, I'm ...",22,kpop
G5hUW6piJTw,KPop Demon Hunters - Coffin Dance Song (Osiris Remix) 💫Season 10💫,When K-pop idols become demon slayers… and the beat never dies. This Season 10 remix fuses the high-energy world of KPop ...,24,kpop
ZyaYnB51lZk,SIGMA GIRL WAR - RESCUING MERMAID RUMI FROM MIRA&#39;S PLOT | KPOP Demon Hunters (Official Music Video),SIGMA GIRL WAR - RESCUING MERMAID RUMI FROM MIRA'S PLOT | KPOP Demon Hunters (Official Music Video) Inside ...,10,kpop
KfWTHmYl4YU,KPOP DEMON HUNTERS ANIMATION COMPLETE EDITION,GH'STUDIO Team @GH.S.,20,kpop
om96KysABLM,“Takedown” Song - K-POP DEMON HUNTERS Clip (2025),Official K-Pop Demon Hunters Movie Clip & Trailer 2025 | Subscribe ➤ https://abo.yt/ki | Now streaming on Netflix | More ...,24,kpop
IlnuqIDED2s,Playlist 🎬 2 Hours K Pop Demon Hunters Official OST,KPopDemonHuntersOST #케데헌 #SajaBoys Immerse yourself in the sound of Netflix's K-Pop Demon Hunters. Two hours of ...,22,kpop
1hfiDxo68FA,🔥다 죽여버리겠다는 그런🔥 : HUNTR/X - Takedown (nocaut) 스페인어 가사해석 l 케이팝 데몬 헌터스,Las guerreras k-pop | Knock-out / nocaut [Takedown] | Español latino #kpopdemonhunters #케이팝데몬헌터스 # #huntrix #huntrx ...,19,kpop
zQMthcjDMbo,HUNTRIX - Golden X Takedown ( Kpop Demon Hunters OST),,20,kpop
-bC4iak3kxg,KATSEYE (캣츠아이) &quot;Gameboy” Official MV,"KATSEYE (캣츠아이) ""Gameboy” Official MV Listen and shop KATSEYE's second EP “BEAUTIFUL CHAOS”, out now: ...",10,kpop
w2Oh73-ZPro,Zoey Kissed Her CRUSH At Girls Only POOL PARTY in Roblox! (Kpop Demon Hunters),"Today Zoey Kissed Her CRUSH At Girls Only POOL PARTY in Roblox! Rumi, Zoey, and Mira Huntrix are having a GIRLS ONLY ...",20,kpop
QXI5UheuOf8,&quot;Your Idol&quot; x SPRUNKI / K-Pop Demon Hunters - Parody,PLAY NOW - https://patreon.com/SPRUNKISUS Any questions and suggestions - apimenov900@gmail.com.,20,kpop
-2JugmaSB4E,Golden (Saja Boys Version) | KPop Demon Hunters Animation |【Male Cover】,"Saja Boys | ""Golden"" | Kpop Demon Hunters (Fan Animation) 【Male Cover】out on Streaming Services: ...",10,kpop
8E6FxeimYso,Huntrix - GOLDEN (Sub. Español + Lyrics) | Kpop Demon Hunters,"HUNTR/X, EJAE, AUDREY NUNA, REI AMI & KPop Demon Hunters - GOLDEN (Sub. Español + Lyrics) HUNTR/X, EJAE, ...",10,kpop
fjOeJssZX_Q,&quot;Free&quot; | Official Lyric Video | Sony Animation,"Where are our Rujinu fans at? Enjoy the official lyric video for ""Free"" from KPop Demon Hunters. The film is now available ...",1,kpop
PAcOt5Ov61Y,KPop Demon Hunters cute and funny moments 😂 pt.6 #kpdh #kpop #kpopdemonhunters #cosplay #rumi #jinu,"Tags: kpdh, KPop demon hunters cute and funny moments, KPop demon hunters cosplay, KPop Demon Hunters song, KPop ...",24,kpop
GKtSQOmJ24g,Funny KPop Demon Hunters (Romance) 😂😂,funny #kpop #memes #shorts.,24,kpop
HLqE5GYe150,“Takedown” Song - K-POP DEMON HUNTERS Movie Clip (2025),"Watch the official clip from K-Pop Demon Hunters! Streaming on Netflix now. Follows a world-renowned girl group, as they ...",24,kpop
iojQFPplbic,Who Should Wednesday Be for Halloween? - &quot;KPop Demon Hunters (케이팝 데몬 헌터스)&quot;,"""Soda Pop"" is a song performed by Andrew Choi, Neckwav, Danny Chung, Kevin Woo, and SamUIL Lee as the fictional boy band ...",10,kpop
n5OAA0SeWnA,Funny Escalator Tutorial #katebrush #tutorial #shorts,,24,tutorial
4KZa5QrrlrA,Arm wave tutorial - Beginners dance tutorial - Try it now,"Classic armwave breakdown, easy simple 12 steps to follow The elbows will probably be the hardest part when you first start but ...",22,tutorial
-sH0rbYdzmA,SLICKBACK DANCE TUTORIAL (FORWARD) 🔥🔥,slickback #tutorial #dance #skills #short #shorts #shortvideo #dancetutorial #slickbacktutorial #easytutorial.,24,tutorial
8TiUhJtz1h4,Eye tutorial #art #eyesketch #tutorial #drawing #youtubeshorts #shorts,,22,tutorial
S9fIz4yAZd4,Paper stars tutorial :) #asthetic #art #tutorial #shorts,,22,tutorial
H0qQfljdhCg,Air walk tutorial 🔥 #funk #remix #airwalk #tutorial #dance #shortsfyp #shorts #slickback #jubislide,,22,tutorial
VFhcF3fWSa0,🎃 tutorial on how to make your character move! #shorts #alien #art #artandcraft #craft #fpy #meme 🎭,,22,tutorial
8JJ101D3knE,Git Tutorial for Beginners: Learn Git in 1 Hour,Git: The essential tool for modern development. This quick explainer shows why it's a must-have skill. ❤️ Join this channel to ...,27,tutorial
wPW3Rzz06Ek,Soda Pop - DANCE TUTORIAL | K-Pop Demon Hunters,"A step by step, beginner friendly dance tutorial to Saja Boys - Soda Pop from K-Pop Demon Hunters on Netflix. DC: ? (I wasn't ...",22,tutorial
oTX-rINkrJc,Word Full Course Tutorial,Word Full Course Tutorial Get Ad-Free Training by becoming a member today!,27,tutorial
YUBTYbQxTi4,Moonwalk Tutorial 🚶🔥,,22,tutorial
nf8ySuesAPg,EXTRA GLAM Makeup Tutorial,Subscribe to my channel : http://bit.ly/2hjbrRN :) DO MY MAKEUP video/game : https://goo.gl/OEknnf Check out my SECOND ...,26,tutorial
zi9I5jhPAQo,Sound like a pro 👐 #piano #pianotutorial #lesson  #tutorial,,22,tutorial
G93NodTztKM,The GHOST step tutorial…,My flexibility program for higher kicks: https://nathearn.com/products/full-flexibility-training-programme Follow my Instagram for ...,17,tutorial
TCM_eADif8A,hanging paper doll tutorial #art #artist #diy,,24,tutorial
5ELpK_yQeJU,Omg!!😱😱TADC Jax &amp; Pomni Easy Magic Trick Tutorial Animation 5 #shrots #tricks #magic #tutorial,Welcome to PINKORO - Arts and crafts room   Today's video is 「Omg!!    TADC Jax & Pomni Easy Magic Trick Tutorial ...,27,tutorial
arjdh5bCm5E,you guys seem to like my tutorials so i figured this might help 😭 #shorts #arttutorial,,24,tutorial
aIhveXDEjH8,Google’s New FREE Vibe-Coding App Is CRAZY (Full Tutorial),Learn how to make money with AI https://bit.ly/earn-with-AI Self-host n8n on Hostinger: http://hostinger.com/aiworkshop ...,28,tutorial
ct-IIengnX8,How I draw eyes tutorial #art #shorts #tutorial #howtodraw,,22,tutorial
OyPPFOzpGic,football skill tutorial🔥⭐️#football #footballskills #soccer #skills #soccerskills #goat,,22,tutorial
GQTUYAhJzY8,👋Tutorial 😅Chapalakh 👋 #littos,,26,tutorial
eWAd6hxGuPE,Revenge makeup #tutorial 🫶🏼❤️‍🔥,,22,tutorial
_pMXH2UtUno,tutorial!! #hangingpaperdoll  #arttutorial #arttrend #artcraft #crafttut #fypage #kpopdemonhunters,,22,tutorial
WR6Tzi4A7ws,Easiest Piano Tutorial Ever! #easy #piano #tutorial,shorts #music #piano ▶️The best online piano course: https://tinyurl.com/getyourpianoforall Thanks for watching! Please ...,10,tutorial
hpIrLFJgMmQ,TUTORIAL — How to make a BABY dragon puppet! // LAST PART // #dragonpuppets #papercrafts #art,,24,tutorial
irGWOMyOPwc,luther - Kendrick Lamar and SZA 🤩 Viral TikTok Dance TUTORIAL! ‼️ #dance #tutorial,,24,tutorial
HPz7mh-9bO8,Rat Dance Tutorial🐀🔥 #shorts,dance #dancetrend #tutorial.,24,tutorial
hKFeYDUzmQQ,How baby penspinners are made🖊🌀 | t1 charge tutorial penspinning #penspinning #tutorial #pentricks,,22,tutorial
14kST-0HI2o,Moonwalk Tutorial,michaeljackson #moonwalk #tutorial #mj #moonwalker #youtubeshorts #shorts #foryou #viralshorts #viral.,22,tutorial
wFk-3ovzRdg,Crochet Scrunchies 💛#crochet #tutorial #crochetscrunchies #beginnercrochet #easycrochet,,22,tutorial
